[of his father] than he was surrounded by fops, coxcombs, "thiggars [97] and sornars," liars and flatterers, who became his favourites and friends.	[ of his father ] than fops , coxcombs , " thiggars [ 97 ] and sornars , " liars and flatterers , who became his favourites and friends surrounded he . 
From that day the preparations for the marriage were begun by both parties; and on an auspicious hour, all the _kazis_ and _muftis_, [394] the learned men and the nobles were convened, and the marriage rites were performed; the bride was carried away with great _eclat_, and all the ceremonies were finished.	From that day both parties began the preparations for the marriage ; and on an auspicious hour , all the _ kazis _ and _ muftis _ , [ 394 ] the learned men and the nobles convened , and the marriage rites performed ; the bride carried away with great _ eclat _ , and all the ceremonies finished . 
 To be sure, this is done by the aid of a little "diablerie," but then it is done very neatly,--much more so than in some of the clumsy fictions of the late Ettrick Shepherd, to say nothing of the edifying legends about the Romish saints which the good people of southern Europe are taught to swallow as gospel.	  be sure , the aid of a little " diablerie does this , " but then it done very neatly,--much more so than in some of the clumsy fictions of the late Ettrick Shepherd , say nothing of the edifying legends about the Romish saints the good people of southern Europe taught which swallow as gospel . 
They are much venerated by the superstitious Asiatics, and are allowed uncommon privileges, which they naturally often abuse.	the superstitious Asiatics much venerate They , and allowed uncommon privileges , which they naturally often abuse . 
To dignify this number still more, sick and wounded persons are supposed, by  oriental novelists, to recover and perform the ablution of cure on the fortieth day.	dignify this number still more , sick and wounded   oriental novelists suppose , persons , recover and perform the ablution of cure on the fortieth day . 
In India money accounts are reckoned by hundreds, thousands, _lakhs_ and _crores_, instead of hundreds, thousands, and millions, as with us.	In hundreds , thousands , _ lakhs reckon India money accounts _ and _ crores _ , instead of hundreds , thousands , and millions , as with us . 
In the time of the Chevalier Chardin, nearly two centuries ago, it was pronounced by that traveller to be the largest in the world.	In the time of the Chevalier Chardin , nearly two centuries ago , that traveller pronounced it be the largest in the world . 
 [201] It is related by grave historians, that _Hatim_ actually built an alms-house of this description.	  [ 201 ] grave historians , that _ Hatim _ actually built an alms - house of this description relates It . 
Bukhara_ is celebrated by Persian poets for its climate, its fruits, and its beautiful women.	Persian poets celebrates Bukhara _ for its climate , its fruits , and its beautiful women . 
 But in all such Cases the Votes of both Houses shall be determined by Yeas and Nays, and the Names of the Persons voting for and against the Bill shall be entered on the Journal of each House respectively.	  But in all such Cases Yeas and Nays , and the Names of the Persons voting for and against the Bill shall determine the Votes of both Houses entered on the Journal of each House respectively . 
 No Preference shall be given by any Regulation of Commerce or Revenue to the Ports of one State over those of another: nor shall Vessels bound to, or from, one State, be obliged to enter, clear, or pay Duties in another.	  any Regulation of Commerce or Revenue shall give No Preference to the Ports of one State over those of another : nor Vessels bound to , or from , one State , obliged enter , clear , or pay Duties in another . 
 No Title of Nobility shall be granted by the United States; and no Person holding any Office of Profit or Trust under them, shall, without the Consent of the Congress, accept of any present, Emolument, Office, or Title, of any kind whatever, from any King, Prince, or foreign State.	  the United States shall grant No Title of Nobility ; and no Person holding any Office of Profit or Trust under them , , without the Consent of the Congress , accept of any present , Emolument , Office , or Title , of any kind whatever , from any King , Prince , or foreign State . 
 But in chusing the President, the Votes shall be taken by States, the Representation from each State having one Vote; a Quorum for this Purpose shall consist of a Member or Members from two thirds of the States, and a Majority of all the States shall be necessary to a Choice.	  But in chusing the President , States , the Representation from each State having one Vote ; a Quorum for this Purpose consist of a Member or Members from two thirds of the States , and a Majority of all the States shall take the Votes be necessary to a Choice . 
 New States may be admitted by the Congress into this Union; but no new States shall be formed or erected within the Jurisdiction of any other State; nor any State be formed by the Junction of two or more States, or Parts of States, without the Consent of the Legislatures of the States concerned as well as of the Congress.	  the Congress may admit New States into this Union ; but no new States formed or erected within the Jurisdiction of any other State ; nor any State formed the Junction of two or more States , or Parts of States , without the Consent of the Legislatures of the States concerned as well as of the Congress . 
 It was formed, in fact, by the Articles of Association in 1774.	  the Articles of Association formed , in fact , It in 1774 . 
 All the vital rights of minorities and of individuals are so plainly assured to them by affirmations and negations, guaranties and prohibitions, in the Constitution, that controversies never arise concerning them.	  affirmations and negations , guaranties and prohibitions so plainly assure to them All the vital rights of minorities and of individuals , in the Constitution , that controversies never arise concerning them . 
 The Project Gutenberg Literary Archive Foundation has been approved by the US Internal Revenue Service as a 501(c)(3) organization with EIN [Employee Identification Number] 64-622154.	  the US Internal Revenue Service has approved The Project Gutenberg Literary Archive Foundation as a 501(c)(3 ) organization with EIN [ Employee Identification Number ] 64 - 622154 . 
[of his father] than he was surrounded by fops, coxcombs, "thiggars [97] and sornars," liars and flatterers, who became his favourites and friends.	[ of his father ] than fops , coxcombs , " thiggars [ 97 ] and sornars , " liars and flatterers , who became his favourites and friends surrounded he . 
From that day the preparations for the marriage were begun by both parties; and on an auspicious hour, all the _kazis_ and _muftis_, [394] the learned men and the nobles were convened, and the marriage rites were performed; the bride was carried away with great _eclat_, and all the ceremonies were finished.	From that day both parties began the preparations for the marriage ; and on an auspicious hour , all the _ kazis _ and _ muftis _ , [ 394 ] the learned men and the nobles convened , and the marriage rites performed ; the bride carried away with great _ eclat _ , and all the ceremonies finished . 
 To be sure, this is done by the aid of a little "diablerie," but then it is done very neatly,--much more so than in some of the clumsy fictions of the late Ettrick Shepherd, to say nothing of the edifying legends about the Romish saints which the good people of southern Europe are taught to swallow as gospel.	  be sure , the aid of a little " diablerie does this , " but then it done very neatly,--much more so than in some of the clumsy fictions of the late Ettrick Shepherd , say nothing of the edifying legends about the Romish saints the good people of southern Europe taught which swallow as gospel . 
They are much venerated by the superstitious Asiatics, and are allowed uncommon privileges, which they naturally often abuse.	the superstitious Asiatics much venerate They , and allowed uncommon privileges , which they naturally often abuse . 
To dignify this number still more, sick and wounded persons are supposed, by  oriental novelists, to recover and perform the ablution of cure on the fortieth day.	dignify this number still more , sick and wounded   oriental novelists suppose , persons , recover and perform the ablution of cure on the fortieth day . 
In India money accounts are reckoned by hundreds, thousands, _lakhs_ and _crores_, instead of hundreds, thousands, and millions, as with us.	In hundreds , thousands , _ lakhs reckon India money accounts _ and _ crores _ , instead of hundreds , thousands , and millions , as with us . 
In the time of the Chevalier Chardin, nearly two centuries ago, it was pronounced by that traveller to be the largest in the world.	In the time of the Chevalier Chardin , nearly two centuries ago , that traveller pronounced it be the largest in the world . 
 [201] It is related by grave historians, that _Hatim_ actually built an alms-house of this description.	  [ 201 ] grave historians , that _ Hatim _ actually built an alms - house of this description relates It . 
Bukhara_ is celebrated by Persian poets for its climate, its fruits, and its beautiful women.	Persian poets celebrates Bukhara _ for its climate , its fruits , and its beautiful women . 
All  scripture is inspired by God and profitable for teaching, for reproof, for  correction, and for training in righteousness; 17 so that the man of God  may be complete, equipped for every good work.	God inspires All   scripture 17 so that the man of God   be complete , equipped for every good work and profitable for teaching , for reproof , for   correction , and for training in righteousness ; . 
4 When they  came to Jerusalem, they were welcomed by the church and the apostles  and the elders, and they reported all that God had done with them.	4 When they   came to Jerusalem , the church and the apostles   and the elders welcomed they , and they reported all that God done with them . 
And after they had spent some  time there, they were sent off in peace by the brethren to those who had  sent them.	And after they spent some   time there , the brethren sent off in peace they to those who had   sent them . 
And as Paul talked on and on, he was overcome by sleep and fell  down from the third story and was picked up dead.	And as Paul talked on and on , sleep overcame he and fell   down from the third story and picked up dead . 
This man was seized by the  Jews, and was about to be killed by them, when I came upon them with  the troops and rescued him, having learned that he was a Roman citizen.	the   Jews seized This man , and was about killed them , when I came upon them with   the troops and rescued him , learned that he was a Roman citizen . 
11  But the centurion was more persuaded by the pilot and the owner of the  ship than by what was being said by Paul.	11   But the pilot and the owner of the   ship more persuaded the centurion than by what said Paul . 
And it had been revealed to  him by the Holy Spirit that he would not see death before he had seen the  Lord's Christ.	And the Holy Spirit had revealed to   him it that he not see death before he seen the   Lord 's Christ . 
For each tree is known by its own fruit.	For its own fruit knows each tree . 
But wisdom is justified by all her children."	But all her children justifies wisdom . " 
All things have been delivered to me  by my Father, and no one knows who the Son is except the Father, and  who the Father is except the Son, and the one to whom the Son chooses  to reveal him."	my Father have delivered to me   All things , and no one knows who the Son is except the Father , and   who the Father is except the Son , and the one to whom the Son chooses   reveal him . " 
You will be betrayed even by  parents and brothers, relatives and friends; and they will put some of you  to death.	even   parents and brothers , relatives and friends will betray You ; and they put some of you   to death . 
17 You will be hated by all for my name's sake.	17 all for my name 's sake will hate You . 
It  was declared at first by the Lord, and it was confirmed to us by those who  heard him, 4 while God also bore witness, by signs and wonders and  various miracles, and by gifts of the Holy Spirit distributed according to  his own will.	the Lord declared at first It   , and it confirmed to us those who   heard him , 4 while God also bore witness , by signs and wonders and   various miracles , and by gifts of the Holy Spirit distributed according to   his own will . 
7  And without dispute the lesser person is blessed by the greater.	7   And without dispute the greater blesses the lesser person . 
In this  case tithes are received by mortal men, but in that case by one of whom it  is witnessed that he lives on.	In mortal men receive this   case tithes , but in that case by one of whom it   witnessed that he lives on . 
They serve a copy and shadow of the heavenly sanctuary; for when  Moses was about to erect the tabernacle, he was instructed by God,  saying, "See that you make everything according to the pattern which was  shown you on the mountain."	They serve a copy and shadow of the heavenly sanctuary ; for when Moses was about   erect the tabernacle , God , instructed he   saying , " See that you make everything according to the pattern which   shown you on the mountain . " 
But if anyone loves God, he is known by him.	But if anyone loves God , him knows he . 
32  But when we are judged, we are disciplined by the Lord so that we will  not be condemned along with the world.	32   But when we judged , the Lord discipline we so that we   not condemned along with the world . 
9 Men were scorched by the fierce  heat, and they cursed the name of God who had power over these plagues,  and they did not repent and give him glory.	the fierce   heat scorched 9 Men , and they cursed the name of God who had power over these plagues ,   and they not repent and give him glory . 
And he  who loves me will be loved by my Father, and I will love him and  manifest myself to him."	And my Father will love he   who loves me , and I love him and   manifest myself to him . " 
And what wisdom is this  which is given to him, that such mighty works are performed by his  hands!	And what wisdom is this   which given to him , that his   hands perform such mighty works ! 
But a woman whose little daughter was  possessed by an unclean spirit heard about him, and she came and fell at  his feet.	But an unclean spirit whose little daughter   possessed a woman heard about him , and she came and fell at   his feet . 
Then Jesus was led up by the Spirit into the wilderness to be  tempted by the devil.	Then the Spirit led up Jesus into the wilderness be   tempted the devil . 
And  you will be hated by all for my name's sake.	And   all for my name 's sake will hate you . 
 	27 "All things have been delivered to me by my Father.	 	 27 " my Father have delivered to me All things . 
"Either make the tree good, and its fruit good; or make the  tree bad, and its fruit bad; for a tree is known by its fruit.	" Either make the tree good , and its fruit good ; or make the   tree bad , and its fruit bad ; for its fruit knows a tree . 
3)	It may not be sold by anyone other than the editor.	3 ) 	 anyone other than the editor not may sell It . 
You are not restricted by us, but you are  restricted in your own affections.	us not restrict You , but you   restricted in your own affections . 
Every charge must be  established by the evidence of two or three witnesses.	the evidence of two or three witnesses   must establish Every charge . 
For a married woman is bound by law to her husband as long as  he lives, but if her husband dies she is released from the law of her  husband.	For law binds a married woman to her husband as long as   he lives , but if her husband dies she released from the law of her   husband . 
Look at the ships also; though they are so great and are driven  by strong winds, they are guided by a very small rudder wherever the will  of the pilot directs.	Look at the ships also ; though they are so great and driven   strong winds , a very small rudder guide they wherever the will   of the pilot directs . 
And  the harvest of righteousness is sown in peace by those who make peace.	And   those who make peace sows in peace the harvest of righteousness . 
