passive_sentence,active_sentence,passive_x_coord,passive_y_coord,active_x_coord,active_y_coord
"The details of the affair, which were soon known, were received by the public with mingled feelings of amusement and amazement.","The public received the details of the affair, which were soon known, with mingled feelings of amusement and amazement.",0.002821873621677428,0.1209139016834498,0.001849945622243262,0.12247311424906152
"The extent and value of this trade to Minnesota, which was then in its infancy, can easily be judged by a brief statement of its growth.","A brief statement of its growth, easily can judge the extent and value of this trade to Minnesota, which was then in its infancy.",0.0026553084364309486,0.10472322737460721,0.0026889830899581267,0.06349433181967784
"Both properties, clearness and light color, cannot be obtained by the same process.","The same process not can obtain both properties, clearness and light color,.",0.007639521747910246,0.01597777419706197,0.004293466873453842,0.06129235913086421
That his meals must be cooked either by persons of his own caste or a Brahmin . 4.,That either persons of his own caste or a Brahmin must Cook his meals.,3.5071663740319885e-05,-0.13574160539678082,-0.0016916567438154551,-0.06088611324264502
This was accomplished by experimental work of the highest order.,Experimental work of the highest order accomplished this.,-0.003911009178199181,-0.03293944330509485,-0.010501503477736585,-0.10485839328672578
"The scenery and drop curtain, which was necessarily of small dimensions, was painted by the sterling and versatile artist, William P. Morris.","The sterling and versatile artist, William P. Morris painted the scenery and drop curtain, which was necessarily of small dimensions,.",0.0036242188774609696,0.030971466345568174,0.0015245215548916613,0.05853624112330798
This arm had been adopted by the Prussian government and was now for the first time on a great scale brought to the crucial test.,The Prussian government had adopted this arm and was now for the first time on a great scale brought to the crucial test.,0.0034127393037876493,0.021848505670871154,0.002471627721967496,0.051629544093977436
"The exclamation was caused by a sudden outburst that sent the snow whirling through the opening and the crevice, from which the Bear-Skin dropped, as if struck a blow from the other side.","A sudden outburst that sent the snow whirling through the opening and the crevice, from which the bear - skin dropped caused the exclamation, as if struck a blow from the other side.",-0.002635352806971412,0.1516839696505508,-0.005814389399049496,0.12006843554669386
"This relic was brought from Palestine by Henry the lion in the eleventh century, and is encased in silver.","Henry the lion brought from Palestine this relic in the eleventh century, and is encased in silver.",0.008474766403648132,-0.012406898030233614,0.006852484290610551,-0.023130936290883426
"Later in the same year the corpses of some thirty persons and some graves were discovered by the Esquimaux on the mainland, and five other bodies were subsequently found on an island close to it, and about a day ’ s journey North-West of back ’ s great fish River.","Later in the same year the Esquimaux some graves discovered the corpses of some thirty persons and on the mainland, and five other bodies were subsequently found on an island close to it, and about a day ’ s journey North - West of back ’ s great fish River.",0.008381000054922448,-0.001253321721169584,0.006524641449781098,-0.006755008021212889
"Kweek, the little Field-Vole, asleep in his hidden nest beneath the Moss, was roused by the promise that Olwen, the White-Footed, who had come to her own beautiful Valley among our Western hills, whispered as she passed along the slope above the Mill-Dam in the Glen.","The promise that Olwen, the White - footed, who had come to her own beautiful Valley among our Western hills, whispered as she passed along the slope above the mill - dam in the Glen roused Kweek, the little field - Vole, asleep in his hidden nest beneath the Moss,.",-0.0017410740356551902,-0.02188796406722258,-0.0035206615904357927,-0.012360673580664307
"He was surrounded by broken fragments of limbs, and it was evident that the tree had not struck him a full blow.","Broken fragments of limbs surrounded him, and it was evident that the tree had not struck him a full blow.",0.002279615236690535,0.13844403421844387,0.0015828987975311723,0.1515308235731284
"But, according to Comte, this knowledge can only be obtained by the observation of the methods which the mind has indeed followed.","But, according to Comte, the observation of the methods which the mind has indeed followed only can obtain this knowledge.",0.00270722377413181,-0.0023060984768882055,-5.089399871872273e-05,0.015875007110007975
"Now and then I was awakened by flitting breezes, and then I thought of thee.","Now and then flitting breezes awakened me, and then I thought of thee.",-0.0037433202527925504,0.0379015363817025,-0.00620111774806633,0.0012678322332373357
The power of the water molecule to associate itself with molecules of other substances is illustrated by the well-known fact that water is an almost universal solvent.,The well - known fact that water is an almost universal solvent illustrates the power of the water molecule to associate itself with molecules of other substances.,-0.003343268276219399,-0.11229499508680191,-0.005073071128539112,-0.08926583847525221
"The universities of both Milan and Pavia were saved by his energy, and his attitude towards education was always generous and impersonal.","His energy saved the universities of both Milan and Pavia, and his attitude towards education was always generous and impersonal.",0.002934301210333925,0.14975295511230052,-0.0006162544765294921,0.09580038735228627
It must have been printed centuries ago by the look of it.,The look of it must have printed it ago centuries.,0.004446884642830074,-0.013245275230817477,0.0013171755638867343,0.015386416914694896
"The wind being fair, on the night of March 16th, 1800, the signal for sailing was given by the Commodore.","The wind being fair, on the night of March 16th, 1800, the Commodore gave the signal for sailing.",0.004008901662248177,0.20260121098130843,0.003150935257964552,0.22728658417126035
The Army to which he belonged was led by a man of clear vision and undaunted resolution.,A man of clear vision and undaunted resolution led the Army to which he belonged.,0.005467499544935698,0.03507322314168118,0.003562312497227398,0.03205027329500135
"He was attended, as far as I could make out, by two smart non-commissioned officers of the line, also big and imposing.","Two smart non - commissioned officers of the line, also big and imposing attended, as far as I could make out, him.",0.002868014754537828,0.05005902400642777,-0.0050333639701018885,-0.01736339730855064
The means were readily supplied by merchants of Seville.,Merchants of Seville readily supplied the means.,0.007204799041022943,0.25336073504384293,0.001201829448174127,0.1514958077614631
It was noted by those who watched their approach that once both of them stopped short and seemed to waver in their determination to advance.,Those who watched their approach noted it that once both of them stopped short and seemed to waver in their determination to advance.,-0.0051809276640357275,0.222297409289058,-0.006942338019254255,0.2535154577815387
"The Island is bounded by the Atlantic ocean on the North, the Mona channel on the East, the Caribbean sea on the South, and the Windward passage on the West.","The Atlantic ocean bounds the island the Mona channel on the East, the Caribbean sea on the South, and the Windward passage on the West on the North,.",0.002079403983926809,-0.1833963196613862,-0.001264481129982245,-0.06384141632664588
"They should be kept in good heart, by the quality of their food.","The quality of their food should keep in good heart, them.",0.0023351243269709547,-0.030460695718649244,-0.002700560075860003,-0.03481725190273223
"But Recluses are not usually accompanied by young daughters, whose relations with the world, not being as antagonistic, would make them uncertain companions.","But young daughters, whose relations with the world, not usually accompany Recluses not being as antagonistic, would make them uncertain companions.",-0.0031475391318316046,0.022067807969402418,-0.007454939390822996,0.004302877465020848
"But his scholarship was redeemed from Pedantry by his wide reading, and by his genuine enthusiasm for all that is graceful in literature, modern as well as ancient.","But his wide reading redeemed from Pedantry his scholarship, and by his genuine enthusiasm for all that is graceful in literature, modern as well as ancient.",-0.002526574841060686,0.02875581336107963,-0.00665422624702058,-0.054229637924344286
"The pressure is increased by the electric Trams, which run on a single set of rails to the Broadway.","The electric Trams, which run on a single set of rails to the Broadway increase the pressure.",-0.0035586469283769707,0.04017965586420104,-0.0069893941644626825,0.023258095345187448
The last line of Entrenchments against Ennui and discomfort was provided by that wonderful Organisation the Expeditionary force Canteens.,That wonderful Organisation the Expeditionary force Canteens provided the last line of Entrenchments against Ennui and discomfort.,0.003958572643664591,0.062238725888244126,0.0015158267150527163,0.04939673258715956
The clay Morainic district was originally dominated by forests of oak and hickory.,Forests of oak and hickory originally dominated the clay Morainic district.,0.004064832668547708,0.049422857588045474,0.0020319501742145007,0.06953661278880352
"A funeral oration in Latin was delivered on the occasion in the chapel of Yale college, by Mr. Stiles, then senior tutor in that institution, and afterwards its distinguished President.","Mr. Stiles, then senior tutor in that institution, and afterwards its distinguished President delivered on the occasion in the chapel of Yale college, a funeral oration in Latin.",-0.0004013486601311913,-0.025490349191000714,-0.005446815489973942,-0.10730601967382469
"She was carried away by her captors, and finally adopted into their tribe.","Her captors carried away her, and finally adopted into their tribe.",0.007308011370066356,0.1010231410748533,0.00316758958307893,0.054109553808301576
"The Dutch distributions could be approximated by Lognormal distributions, but the mean, variance and the size of the labour force changed.","Lognormal distributions could approximate the Dutch distributions, but the mean, variance and the size of the labour force changed.",0.003824725718831229,0.17043101698445312,0.0007539743294393469,0.18136904825955225
"Here the speaker was interrupted by a howl from the rangers, who had just realized how very hungry they were, and how impossible it would be to carry on a mutiny unless properly clad for such an undertaking.","Here a howl from the rangers, who had just realized how very hungry they were interrupted the Speaker, and how impossible it would be to carry on a mutiny unless properly clad for such an undertaking.",-0.0020201787307456472,0.10229228445667163,-0.004482956173334283,0.04473080247694719
“ that was made by an expert who understands Infernal machines with a malevolent genius.,“ an expert who understands Infernal machines with a malevolent genius made that.,-0.012303779358670589,-0.08534191965682388,-0.01731796613098659,-0.16913572070373628
"A week of Torrid heat, in which London crawled, groaned, and panted, had been wiped from the memory by an over-night thunderstorm that burst the pent-up dams of heaven and loosed cool floods upon the staring streets.","An over - night thunderstorm that burst the pent - up dams of heaven and loosed cool floods upon the staring streets had wiped from the memory a week of Torrid heat, in which London crawled, groaned, and panted,.",-0.005209315093371752,-0.0038788634079336,-0.008586157336706183,-0.0014648304351977878
"Even some of their oars were snatched from them by the Indians, and Drake was wounded by an arrow in the cheek and struck by a stone on the side of his face.","The Indians snatched from them even some of their oars, and Drake was wounded by an arrow in the cheek and struck by a stone on the side of his face.",0.0014192017391258219,0.1409439161085831,-0.0011145408486822254,0.12060667494520258
"It was built by Clarke, of Philadelphia, and was a fine vehicle, with a Cream-Colored body and wheels, green Venetian blinds and the Washington arms painted upon the doors.","Clarke, of Philadelphia built it, and was a fine vehicle, with a cream - colored body and wheels, green Venetian blinds and the Washington arms painted upon the doors.",0.004314353147626257,-0.031947567427358374,0.0012992065821192129,-0.040522639291509725
"Already he had been adopted as master by four cats and two Mongrel dogs, as he remembered with rather Rueful amusement.","Already four cats and two Mongrel dogs had adopted as master him, as he remembered with rather Rueful amusement.",-0.0026939256713069595,-0.019227101312672017,-0.004398195836608967,-0.010388286763702306
"He was borne on by the excitement of varying fortune, a varying fortune absolutely under control of the dealer, whose Sleight-Of-Hand was perfect.","The excitement of varying fortune, a varying fortune absolutely under control of the dealer, whose Sleight - of - hand was perfect bore on him.",-0.0006544052662960269,0.08862491482104838,-0.006722545563230996,0.05066110862510808
These notes were found by the merest accident.,The merest accident found these notes.,0.000887619903031607,0.12999090849732622,-0.007237873334963755,0.036161520152725314
"From them to dealers who were buying coats and trousers of the same cloth, and at last the complete suits were sold to Wearers by the retailer.","From them to dealers who were buying coats and trousers of the same cloth, and at last the retailer sold to Wearers the complete suits.",0.004304405526598991,0.13609130428180258,0.0014302269705023453,0.11656668516289458
"Threats against their employer and his property were being made by the Hot-Headed leaders, who always appear under such conditions, and the surveyor feared that serious trouble might start at any hour.","The hot - headed leaders, who always appear under such conditions Weremaking threats against their employer and his property, and the surveyor feared that serious trouble might start at any hour.",-0.0009777237817631106,0.16886422335238638,-0.004186530076677098,0.1101210070985536
"The success was gained entirely by the eight hundred Allied horse, the infantry never arriving upon the field.","The eight hundred Allied horse gained entirely the success, the infantry never arriving upon the field.",0.005296723377699576,0.17447994257552188,0.0028686730963698526,0.14997111254116108
"Emigrants were soon attracted in large numbers by the fertility of a Virgin soil, and the more liberal Constitution of the various States.","The fertility of a Virgin soil soon attracted in large numbers Emigrants, and the more liberal Constitution of the various States.",0.0025110574603376063,0.22175625921978143,-0.0028764220556849935,0.09751899108118037
"Landlords, agents, and tenants were murdered in cold blood, peaceful citizens were dragged into foul conspiracy by their bullying neighbours, and Parnell went about in open defiance of the government, preaching rebellion and its ghastly accompaniments wherever he came.","Landlords, agents, and tenants were murdered in cold blood, their bullying neighbours dragged into foul conspiracy peaceful citizens, and Parnell went about in open defiance of the government, preaching rebellion and its ghastly accompaniments wherever he came.",0.0031309441059004465,0.11277553387391687,0.0019025969708809055,0.1019596250540119
The divergence from European to an Anglo-American Hand-Tool design and the approximate date that it occurred can be suggested by a comparison of contemporary illustrations.,A comparison of contemporary illustrations can suggest the divergence from European to an Anglo - American hand - tool design and the approximate date that it occurred.,-0.0008508968910736232,0.02622740890416215,-0.0011512253699886858,0.047400761085489636
"Of later years, in several conspicuous cases, even the choice of college officials of high control has been guided rather by their capacity as financiers than for ripened and inspiring scholarship.","Of later years, in several conspicuous cases, rather their capacity as financiers has guided even than for ripened and inspiring scholarship the choice of college officials of high control.",-0.002221575580392844,0.10862593625573867,-0.0033091957042427674,0.10751666018077433
