passive_sentence,active_sentence,passive_x_coord,passive_y_coord,active_x_coord,active_y_coord
In cases of dispute the matter shall be resolved by the judgement of the twenty-five barons referred to below in the clause for securing the peace.,In cases of dispute the judgement of the twenty - five barons referred to below in the clause for securing the peace shall resolve the matter.,-0.006234239335359885,0.10102116898009363,-0.007181883609813014,0.06753926263936325
A dispute on this point shall be determined in the Marches by the judgement of equals.,The judgement of equals shall determine in the Marches a dispute on this point.,-0.005562748340387529,0.05797118356211836,-0.004229598387370481,-0.011084891821977368
This matter shall be resolved by the judgement of his equals in our court.,The judgement of his equals shall resolve this matter in our court.,-0.004213245372437909,0.08699167829761421,-0.006757470731915966,0.058671561208321975
"If any Freeman shall die Intestate, his chattels shall be distributed by the hands of his nearest Kinsfolk and friends, under supervision of the church, saving to every one the debts which the deceased owed to him.","If any Freeman shall die Intestate, the hands of his nearest Kinsfolk and friends shall distribute his chattels, under supervision of the church, saving to every one the debts which the deceased owed to him.",-0.005786434563153262,0.06325925492474252,-0.006632829460433243,0.04344466503782697
"All evil customs connected with forests and Warrens, Foresters and Warreners, sheriffs and their officers, River-Banks and their wardens, shall immediately be inquired into in each county by twelve sworn Knights of the same County chosen by the honest men of the same County, and shall, within forty days of the said inquest, be utterly abolished, so as never to be restored, provided always that we previously have Intimation thereof, or our Justiciar, if we should not be in England.","Twelve sworn Knights of the same County chosen by the honest men of the same County, immediately shall inquire into in each county all evil customs connected with forests and Warrens, Foresters and Warreners, sheriffs and their officers, River - banks and their wardens, and shall, within forty days of the said inquest, be utterly abolished, so as never to be restored, provided always that we previously have Intimation thereof, or our Justiciar, if we should not be in England.",-0.004272930587608751,-0.013694365323585951,-0.0059129362814337744,0.0025799172501511387
"Moreover, all these aforesaid customs and liberties, the observance of which we have granted in our Kingdom as far as pertains to us toward our men, shall be observed by all of our Kingdom, as well clergy as laymen, as far as pertains to them toward their men.","Moreover, all of our Kingdom, as well clergy as laymen,, the observance of which we have granted in our Kingdom as far as pertains to us toward our men, shall observe all these aforesaid customs and liberties as far as pertains to them toward their men.",-0.006789695688547796,0.06599708308541635,-0.00796776670275202,0.04060754536623589
"If any Freeman shall die Intestate, his chattels shall be distributed by the hands of his nearest Kinsfolk and friends, under supervision of the church, saving to every one the debts which the deceased owed to him.","If any Freeman shall die Intestate, the hands of his nearest Kinsfolk and friends shall distribute his chattels, under supervision of the church, saving to every one the debts which the deceased owed to him.",-0.005786434563153262,0.06325925492474252,-0.006632829460433243,0.04344466503782697
"The inner story must be uncovered, personally, by each reader, according to ability and desire.","Each reader must uncover, personally, the inner story, according to ability and desire.",-0.004798386362250828,0.08502109153537127,-0.01013140654746127,0.15251182318576395
"Beneath me, the spot that I had just left, was occupied by the foul Swine-Creature.","Beneath me, the foul swine - creature, occupied the spot that I had just left.",0.0003823873291362934,-0.0025097914011708976,-0.003766092652169743,0.021378644078535628
"I was answered by a joyful bark, and renewed and frantic caresses.","A joyful bark answered me, and renewed and frantic caresses.",-0.009070392539128955,0.10993201689458114,-0.01725849432983933,0.2024232594504881
It was answered by a similar NOTE from the bottom of the pit.,A similar NOTE answered it from the bottom of the pit.,0.007910303289268662,-0.041864737001490536,0.002563806493805233,0.030596444138522225
My attention was distracted by a noise in the direction of the back door.,A noise in the direction of the back door distracted my attention.,-0.007829828113370267,-0.032096972860125236,-0.012544361683148476,0.12384924711135502
"The second time, my shot was answered by a short squeal of pain.","The second time, a short squeal of pain answered my shot.",-0.007779801927717009,-0.04360389712704901,-0.011862298758037303,-0.0107417036640859
"The entrance to the place whence the Swine-Creatures had come, was sealed up, by a power that made me feel there was nothing more to fear from them.","A power that made me feel there was nothing more to fear from they, sealed up, the entrance to the place whence the swine - creatures had come.",0.0015395803373589828,-0.043116935569533055,-0.005448437677150128,0.05858813026610261
"Now, however, for a little space, the sky was hidden, by a sea of swaying, Leaden-White clouds, which lightened and blackened, alternately, with the passage of day and night.","Now, however, for a little space, a sea of swaying, leaden - white clouds, which lightened and blackened, alternately, with the passage of day and night hid, the sky.",0.005313535296082564,-0.06722120210299615,-0.0061573501636543486,0.149433870075944
"If it had Mouldered under me, surely, I should have been waked by the collapse.","If it had Mouldered under me, surely, the collapse should have waked me.",0.004014644446168841,-0.133326985531212,0.002404027700064373,-0.11320206429167719
"As I approach the Kennel, I am greeted by the same Mouldy stench that assailed me at the door last night.","As I approach the Kennel, the same Mouldy stench that assailed me at the door last night GREETS me.",-0.0056549812179222895,-0.055597395045813375,-0.006345972887643241,-0.0365029285337637
"The Republic was voted on the 30th of January, 1875, by a majority of one vote, if majority it could be called, but the great step had been taken, and the struggle began instantly between the moderate conservative Republicans and the more advanced left.","A majority of one vote voted on the 30th of January, 1875, the Republic, if majority it could be called, but the great step had been taken, and the struggle instantly between the moderate conservative Republicans and the more advanced left began.",0.0023094917247254146,-0.03522589692245317,-0.0016261690868240096,-0.029968627181959615
He was surrounded by an admiring crowd when he walked in the foyer.,An admiring crowd surrounded him when he walked in the foyer.,0.003378548115925836,-0.07236203941831235,0.0007415264912150152,-0.03092993591422296
"They are generally made by people of the same Monde, accustomed to the same way of living, and the fortunes as nearly alike as possible.","People of the same Monde generally make them, accustomed to the same way of living, and the fortunes as nearly alike as possible.",0.0021804352309913078,0.1073887815688678,-0.00847232752837178,0.0699814739174631
"Even W., who knew him well and admired him immensely, was struck by his brilliant improvisation.","His brilliant improvisation struck even W., who knew him well and admired him immensely,.",-0.006888744690535523,-0.04014033720649457,-0.00784370206587072,-0.016604838211792067
"She was attracted by the group of children, stopped and talked to them.","The group of children attracted her, stopped and talked to them.",-0.004733500642388071,-0.04792313536303541,-0.00441298495941407,-0.04295724570933617
"Some days before the meeting of the Congress the old emperor had been wounded in the arm by a nihilist, Nobiling, who fired from a window when the Emperor was passing in an open carriage.","Some days before the meeting of the Congress a nihilist, Nobiling, who fired from a window when the Emperor was passing in an open carriage had wounded in the arm the old Emperor.",0.002075579261881083,-0.06358158170522585,-0.0023776706456056394,0.0007060519108563444
The treaty was signed on July 13 by all the Plenipotentiaries in full uniform.,All the Plenipotentiaries in full uniform signed on July 13 the treaty.,0.0006951073874004263,-0.10027256931247307,-0.004112102304400211,-0.06726004140896674
Many old school and college experiences were evoked that year by the various English who passed through Paris.,The various English who passed through Paris evoked that year many old school and college experiences.,0.00016593373265854586,-0.03355423587468083,-0.006188957536167721,-0.0020403071053938914
Mankind is weighted by every previous sin.,Every previous sin weights mankind.,-0.0031524349836701193,-0.005256319158570662,-0.009563416846729025,-0.013480120649222455
"We are daily visited by appeals which are ministering to our growth and progress, or which are tending to our spiritual downfall.","Appeals which are ministering to our growth and progress daily visit us, or which are tending to our spiritual downfall.",-0.010236662907814923,0.17637625481791946,-0.016575962351505914,0.2794922935245096
We are daily enriched by the experience of mere obedience.,The experience of mere obedience daily Enriches us.,-0.008938273035774576,0.04033047835334395,-0.01576404631088254,0.06568095590197179
The path to the church is worn by the feet of generations.,The feet of generations wear the path to the church.,0.0003847124424349223,0.01688164122836363,-0.0031597528581740427,-0.013544859933175703
"They are held by its tenets, guided by its ideals, thrilled by its hopes, and set to its works of charity and mercy.","Its tenets, guided by its ideals, thrilled by its hopes hold them, and set to its works of charity and mercy.",-0.0037064398200236334,0.14919957370505998,-0.011067962570601525,0.2212310269811122
This reconstruction cannot possibly be effected by schools of theology alone.,Schools of theology alone not possibly can effect this reconstruction.,0.004816772188797185,-0.22285558660009525,0.002300219539801411,-0.24861696174688785
"No soul is finally held by the indefinite, or the Namby-Pamby.","The indefinite finally holds no soul, or the Namby - Pamby.",-0.0029271769830704537,0.016421555536626685,-0.010772788816784024,0.10333937917516174
"One must be bolstered up by a generation of convinced and believing men, before he can draw a church after him.","A generation of convinced and believing men must bolster up one, before he can draw a church after him.",-0.005595519171601782,0.03242801572433758,-0.012207451616900938,0.18932194625333254
"Second, that he is bound hand and foot by conditions existing in the organization and personnel of his church, and hence is not free to act.","Second, that conditions existing in the organization and personnel of his church bind him hand and foot, and hence is not free to act.",0.0061387677658595345,-0.1377320363088544,0.005869314180512061,-0.16452706101125164
"Small things may be pecked at, trifles may be made mountains of by the disgruntled, but where does he get a Clear-Sighted, Whole-Hearted estimate of himself and his work?","Small things may be pecked at, the disgruntled may make trifles mountains of, but where does he get a clear - sighted, whole - hearted estimate of himself and his work?",-0.007577877003392125,0.16795661532227846,-0.009083281998057965,0.15822627218835594
"It is determined by far-reaching industrial conditions, and by economic law.","Far - reaching industrial conditions determine it, and by economic law.",0.0029124109299506966,0.09032279179345233,-0.0012039612944327455,0.10374368234125098
This beauty should not be monopolized by any one class.,Any one class not should monopolize this beauty.,-0.007066213462853585,0.08269440026775023,-0.01518034997902646,0.15719508369317614
"The blockhouse Parallelograms and squares should be replaced by something that has intrinsic beauty and the haunting completeness of memory and Association, so that the place where a man works shall no more be to him a nightmare, but the atmosphere and inspiration of his dreams!","Something that has intrinsic beauty and the haunting completeness of memory and Association should replace the blockhouse Parallelograms and squares, so that the place where a man works shall no more be to him a nightmare, but the atmosphere and inspiration of his dreams!",-0.009043793772863823,0.1489244257363372,-0.01577839225299792,0.29571834000902153
It was broken by a scream of terror from forward.,A scream of terror from forward broke it.,0.000546332347629553,-0.03502915365079241,-0.011022058478431572,0.04233750777355133
It was followed in quick succession by three others.,Three others followed in quick succession it.,-0.0018913735464883873,-0.050794476521329124,-0.009200745776621649,0.017676941818501303
Finally the monotony was broken by an incident.,Finally an incident broke the monotony.,-0.004828692081680993,-0.028209755069036876,-0.010298548446254724,-0.026078620553371734
He was possessed by the wildest excitement.,The wildest excitement possessed him.,-0.008196224234448523,0.027162886510384184,-0.015040127331392952,0.07382944775979507
One evening I was awakened by a sound of violent voices.,One evening a sound of violent voices awakened me.,-0.006875321260599806,0.0616131290675243,-0.01307034637461957,0.12373692143329082
Their clothes were picked by brush and their boots muddy.,Brush and their boots picked muddy their clothes.,-0.003334201283579033,-0.062272178217244054,-0.007923390666925125,-0.06609501486402894
These were occasionally broken by smaller Tributary Arroyos of the same sort.,Smaller Tributary Arroyos of the same sort occasionally broke these.,0.0033523338684532705,0.00864761477036204,-0.0025534840021674524,0.08255374934737975
"He was accompanied by the nigger, very much terrified, very much burdened with food and cooking utensils.","The nigger, accompanied him very much terrified, very much burdened with food and cooking utensils.",0.003129166723584087,-0.07782004224540455,-0.0011030427804885209,-0.04318239550349734
"Besides a lot of scientific apparatus and chests of chemical supplies, everything that could possibly be required, had been provided by that omniscient young man.","Besides a lot of scientific apparatus and chests of chemical supplies, that omniscient young man had provided everything that could possibly be required,.",-0.0033312217698388256,0.08063598707146774,-0.002885788229198182,0.04215873899479148
"The stores were badly damaged by the wet, and there was no liquor, for which I was sincerely grateful.","The wet badly damaged the stores, and there was no liquor, for which I was sincerely grateful.",0.002491029112882913,-0.11469582864780846,-0.0018948802030121924,-0.07477646932478799
"In that, of course, I was deceived by my inexperience.","In that, of course, my inexperience deceived me.",-0.0020717908573192256,-0.11465044484650021,-0.004847968179382869,-0.08999172869323646
"There could be no doubt, however I may have saved my face, that command had been taken from me by that rascal, handy Solomon.","There could be no doubt, however I may have saved my face, that rascal, handy Solomon had taken from me that command.",0.0014500001107203035,-0.1851851811020434,0.0005351802565973212,-0.19180415175171941
"It was never refused by the resident champion, who promptly slid into the sea, and engaged battle.","The resident champion, who promptly slid into the sea never refused it, and engaged battle.",0.007139288647366437,-0.2652635710074596,-0.0014260848617232693,-0.1737524754550443
"It was broken by a sharp double report, one as of the fall of a metallic substance, the other caused by the body of Pulz, which, shaken loose from the truck by a heavy roll, smashed against the rail of the ship and splashed overboard.","A sharp double report, one as of the fall of a metallic substance broke it, the other caused by the body of Pulz, which, shaken loose from the truck by a heavy roll, smashed against the rail of the ship and splashed overboard.",-0.00023653352711157285,0.013959251472596277,-0.007166247149137101,0.06704033580711292
Entrance may have been closed by a landslide down the cliff.,A landslide down the cliff may have closed entrance.,0.00681101435280256,-0.12314549123224329,0.0009109915363108509,-0.017049737031797282
The changes that have taken place in the Glacial conditions of the Sierra from the time of greatest extension is well illustrated by the series of glaciers of every size and form extending along the mountains of the coast to Alaska.,The series of glaciers of every size and form extending along the mountains of the coast to Alaska well illustrate the changes that have taken place in the Glacial conditions of the Sierra from the time of greatest extension.,0.0012898240693484844,0.04738955662514568,-0.001213317212342307,0.05573110235808941
"The upper branches of nearly all the main Cañons and Fiords are occupied by glaciers, which gradually increase in size, and descend lower until the high region between Mount Fairweather and Mount St. Elias is reached, where a considerable number discharge into the waters of the ocean.","Glaciers, which gradually increase in size, and descend lower until the high region between Mount Fairweather and Mount St. Elias where a considerable number discharge into the waters of the ocean is reached, occupy the upper branches of nearly all the main Cañons and Fiords.",-0.002246953831372083,0.03902002191232684,-0.006633278529761057,0.08245500548074403
"That the domain of the sea is being extended over the land by the wearing away of its shores, is well known, but in these icy regions of Alaska, and even as far South as Vancouver Island, the coast rocks have been so short a time exposed to Wave-Action they are but little wasted as yet.","That the wearing away of its shores is extending over the land the domain of the sea, is well known, but in these icy regions of Alaska, and even as far South as Vancouver Island, the coast rocks have been so short a time exposed to wave - action they are but little wasted as yet.",0.0004167354261970929,0.024289769395110197,-0.0005745405288384968,0.03784663566067055
"The surface of the glacier was further characterized by dirt bands and the Outcropping edges of the blue veins, showing the laminated structure of the ice.","Dirt bands and the Outcropping edges of the blue veins further characterized the surface of the glacier, showing the laminated structure of the ice.",0.0017936596414590673,0.10851924458632622,-0.0002569095118178841,0.14755227161276538
I was awakened in the morning by the rocking of my cabin and the beating of Pine-Burs on the roof.,The rocking of my cabin and the beating of pine - Burs on the roof awakened in the morning me.,-0.006187470386078255,0.03721030478381207,-0.016434577463788555,0.2392437070519074
No perfect Banner is ever hung on the Sierra peaks by a South wind.,A South wind ever hangs on the Sierra peaks no perfect banner.,-4.6071962299438444e-05,-0.006818065960304419,-0.003548077951945112,0.03615803777336929
"A trail was made through it about the time of the Mono gold excitement, in the year 1858, by adventurous miners and Prospectors—Men who would build a trail down the throat of darkest Erebus on the way to gold.","Adventurous miners and Prospectors — men who would build a trail down the throat of darkest Erebus on the way to gold made through it about the time of the Mono gold excitement, in the year 1858, a trail.",-0.0020305973986410666,0.08186050343914643,-0.008209903919918701,0.1491292160115496
"They are always accompanied by the men, who stride on, unburdened and erect, a little in advance, kindly stooping at difficult places to pile Stepping-Stones for their patient, Pack-Animal wives, just as they would prepare the way for their ponies.","The men, who stride on, unburdened and erect, a little in advance, kindly stooping at difficult places to pile stepping - stones for their patient, pack - animal wives always accompany them, just as they would prepare the way for their ponies.",-0.008794510757799278,0.12936690739412415,-0.011270951207163326,0.13049280420465004
Without exception every pass in the Sierra was created by them without the slightest aid or Predetermining guidance from any of the cataclysmic agents.,Without exception they created every pass in the Sierra without the slightest aid or Predetermining guidance from any of the cataclysmic agents.,0.005249431268437478,-0.1016840673881169,0.0027834043606740676,-0.10925893843513654
"The main portion of the Mono pass is formed by bloody Cañon, which begins at the summit of the range, and runs in a general East-Northeasterly direction to the edge of the Mono plain.","Bloody Cañon, which begins at the summit of the range forms the main portion of the Mono pass, and runs in a general East - Northeasterly direction to the edge of the Mono plain.",0.004618615567632927,0.03808839017891866,0.001046822641628727,0.04397379994950957
The effect of this expressive Outspokenness on the part of the Cañon-Rocks is greatly enhanced by the quiet aspect of the Alpine meadows through which we pass just before entering the narrow gateway.,The quiet aspect of the Alpine meadows through which we pass just before entering the narrow Gateway greatly enhances the effect of this expressive Outspokenness on the part of the Cañon - rocks.,-0.007584186672426824,0.06504403377540434,-0.008865674329079452,0.058940653204807014
"Here it is succeeded by the Hardy Two-Leaved pine, which is speedily joined by the taller yellow and mountain pines.","Here the Hardy two - Leaved pine, which is speedily joined by the taller yellow and mountain pines succeeds it.",-0.005339773545526627,0.16282414967530778,-0.008981018564652433,0.1439220422799855
"Bloody Cañon, like every other in the Sierra, was recently occupied by a glacier, which derived its fountain snows from the adjacent Summits, and descended into Mono Lake, at a time when its waters stood at a much higher level than now.","A glacier, which derived its fountain snows from the adjacent Summits, like every other in the Sierra, recently occupied bloody Cañon, and descended into Mono Lake, at a time when its waters stood at a much higher level than now.",0.0013148024169695684,-0.0034820325341277936,-0.007609576690496249,0.18931441517236214
"A few small Lakes Unfortunately situated are extinguished suddenly by a single swoop of an avalanche, carrying down immense numbers of trees, together with the soil they were growing upon.","A single swoop of an avalanche Extinguishes suddenly a few small Lakes Unfortunately situated, carrying down immense numbers of trees, together with the soil they were growing upon.",-0.0012925467363914585,-0.014530291854138237,-0.008562589923269442,0.10351829508024481
"Others are obliterated by Land-Slips, earthquake Taluses, etc., but these Lake-Deaths compared with those resulting from the deliberate and incessant deposition of sediments, may be termed accidental.","Land - slips, earthquake Taluses, etc . obliterate others, but these Lake - deaths compared with those resulting from the deliberate and incessant deposition of sediments, may be termed accidental.",0.005232851799258498,-0.010101249795357183,0.0017070888250232878,0.01178340648868664
"Its crystal waters are clasped around on the North and South by majestic Granite walls sculptured in true Yosemitic style into domes, Gables, and Battlemented headlands, which on the South come plunging down sheer into deep water, from a height of from 1500 to 2000 feet.","Majestic Granite walls sculptured in true Yosemitic style into domes, Gables Clasp around on the North and South its crystal waters, and Battlemented headlands, which on the South come plunging down sheer into deep water, from a height of from 1500 to 2000 feet.",0.002408919303990089,0.11302186616256005,0.001565108498842765,0.05854304730476166
"Where the soil happens to be composed of the finer qualities of Glacial Detritus and the water is not in excess, the nearest approach is made by the vegetation to that of the Lake-Meadow.","Where the soil happens to be composed of the finer qualities of Glacial Detritus and the water is not in excess, the vegetation makes the nearest approach to that of the Lake - meadow.",0.0031686832065071753,0.03925271022782958,0.0015251698429957414,0.010224327063349956
"Unfortunately it is greatly prized by the lumbermen, and in accessible places is always the first tree in the woods to feel their steel.","Unfortunately the lumbermen greatly prize it, and in accessible places is always the first tree in the woods to feel their steel.",-0.00018797659381243267,0.02883765797991874,-0.006535243386945187,0.06970544125381448
"The tall lilies are brought forward in all their glory by the light of your blazing Camp-Fire, relieved against the outer darkness, and the nearest of the trees with their Whorled branches tower above you like larger lilies, and the sky seen through the garden opening seems one vast meadow of white Lily stars.","The light of your blazing camp - fire, relieved against the outer darkness brings forward in all their glory the tall lilies, and the nearest of the trees with their Whorled branches tower above you like larger lilies, and the sky seen through the garden opening seems one vast meadow of white Lily stars.",-0.0007960151097191443,0.06770746837211278,-0.0046413556178517374,0.11648448096315875
