passive_sentence,active_sentence,passive_x_coord,passive_y_coord,active_x_coord,active_y_coord
The road along which she passed was bordered on either side by walls of gray stone covered with Shiny-Leaved Ivy and flanked by a Checkerboard of pastures roughly dotted with clumps of Hardback and Boles of protruding rock.,Walls of gray stone covered with shiny - Leaved Ivy and flanked by a Checkerboard of pastures roughly dotted with clumps of Hardback and Boles of protruding rock bordered on either side the road along which she passed.,0.005322545241610512,-0.008780283553731054,0.001646885561028526,-0.05154936993185845
"They have good appetites, they sleep soundly, they are not oppressed by morbid anticipations of failure nor by the horrible reaction that follows a great artistic effort of any kind except singing.","They have good appetites, they sleep soundly, morbid anticipations of failure nor by the horrible reaction that follows a great artistic effort of any kind except singing not oppress them.",-0.0038642001970026624,0.01776379570296812,-0.007221129416388873,0.02840446013958902
"Monopolies, trusts, and other forms of concentrated wealth are regarded by some as the blessings of a prosperous nation.","Some as the blessings of a prosperous nation regards monopolies, trusts, and other forms of concentrated wealth.",-0.0019175352453075225,-0.0497624612330619,-0.00560218445845565,-0.05286706598040222
"Halfway down the stairs the writhing pair were met by another couple of policemen, by whom the Hunchback was quickly secured and handcuffed.","Halfway down the stairs another couple of policemen, met the writhing pair by whom the Hunchback was quickly secured and handcuffed.",0.0007758248028739642,0.09670697424382599,-0.002353467183395029,0.0701827232556795
"Names and addresses were taken by the reporters, and Ambulances began to remove the severely injured to the city hospitals.","The reporters took names and addresses, and Ambulances began to remove the severely injured to the city hospitals.",0.0011654572897788857,0.16406867978537876,0.0003565527084212316,0.17518049212144174
"At the annual meeting of the society of the Cincinnati, on the 4TH of July, a speech was made by HON . Hamilton fish, Senator-Elect, in which he defined his position with respect to the leading political question of the day.","At the annual meeting of the society of the Cincinnati, on the 4TH of July, hon . Hamilton fish made a speech, Senator - elect, in which he defined his position with respect to the leading political question of the day.",-0.00188829235590591,-0.021578805703759814,-0.002891832519282333,-0.044566575169110306
"They were licensed by the Cabildo of Buenos Aires, who received a third of the profits.","The Cabildo of Buenos Aires, who received a third of the profits licensed them.",0.0069278792852605,0.13555224172802652,0.0018064405893137266,0.03628791113966476
Mayotte was devastated in 1898 by a cyclone of great severity.,A cyclone of great severity devastated in 1898 Mayotte.,0.003684374112075508,0.13000663454120853,0.0024014844262148184,0.08853887987780945
"I was much touched by the feeling with which he spoke, and felt awed as if I were in the presence of death.","The feeling with which he spoke much touched me, and felt awed as if I were in the presence of death.",-0.0004919224108650749,0.033664994921522806,-0.005564113701085635,0.021997011870785114
In this way perhaps the inner history of different lives may be revealed by shocks and the resulting response.,In this way perhaps shocks and the resulting response may reveal the inner history of different lives.,-0.005367401491201554,0.13996665060987568,-0.00814749018983272,0.13253022510219217
The advance of the four guards was checked by a diversion.,A diversion checked the advance of the four guards.,0.0032918033737820733,0.11401717025415214,-0.0020971261023988753,0.029237045014250004
The amount of gasoline in the tank was calculated by depth only and not by capacity.,Depth calculated the amount of gasoline in the tank only and not by capacity.,0.008389382835163885,0.24191817257517664,0.001149646718967392,0.07272552118267435
It is divided by an immense rock into two irregular portions.,An immense rock divides it into two irregular portions.,0.001407092758735112,-0.22924675726826219,-0.0035849429272538933,-0.118317883541739
"Undoubtedly beds of salt are also formed by Inland Lakes, such as the great salt Lake in Utah.","Undoubtedly Inland Lakes, such as the great salt Lake in Utah also form beds of salt.",0.005188361051355105,-0.029374965804021273,0.0014220215374415779,-0.04625512014121719
"Next morning, July 20, Nansen was awakened by a violent concussion.","Next morning, July 20, a violent concussion awakened Nansen.",-0.0005364635126309824,0.04805032524434935,-0.00524467617688461,-0.0731089125524276
The greeting would be conveyed by a short nod or a glance.,A short nod or a glance would convey the greeting.,-0.01156000967211215,-0.09219050372942875,-0.013364203755800812,-0.11471682688063911
"The Countess, who had no children to aid her, was sorely beset, after her husband ’ s death, by Rapacious relatives, whom during his lifetime she had contrived to keep at Bay.","Rapacious relatives, whom during his lifetime she had contrived to keep at Bay sorely beset, after her husband ’ s death, the Countess, who had no children to aid her,.",0.0010755429381559293,0.0646224220092591,-0.0017723272611188004,0.03879089238183492
"Many female slaves of noble descent are mentioned by homer, and their positions in the households of their mistresses are frequently of importance.","Homer mentions many female slaves of noble descent, and their positions in the households of their mistresses are frequently of importance.",0.0014936632200173623,0.054756062497872626,-0.0006984118156789535,0.050189118739460026
"Whenever the experiment is tried, sparks can be produced by friction or the handling of metal, hair, or wool.","Whenever the experiment is tried, friction or the handling of metal, hair, or wool can produce sparks.",-0.004465705034484378,-0.0025835909382601763,-0.008200042084625986,-0.0019915889936381083
But his entry into political life was now properly regulated by his nomination to a Bishopric.,But his nomination to a Bishopric now properly regulated his entry into political life.,0.0052288373712185525,0.03471541245114133,-0.0006835220103333665,-0.06130603107452853
Q . What is meant by the letter J. on the square stone?,Q. the letter J. means what on the square stone?,-0.002186671917662246,-0.11070981174996161,-0.004699519433919049,-0.10413102633219484
The cells were sometimes occupied by prisoners of the lowest class and criminals condemned to death.,Prisoners of the lowest class and criminals condemned to death sometimes occupied the cells.,0.005452572710557577,0.1284759594820049,-0.0018620625915073707,0.005044261676049459
These reports had doubtless been received by Herod with sneers and mocking.,Herod doubtless had received these reports with sneers and mocking.,0.0003261720879597428,0.16380769520550742,-0.005469772268549504,0.08245300011690011
"The miracles which, in an ignorant and superstitious age, were attributed to many who had a reputation for piety, were strenuously disclaimed by him.","He strenuously disclaimed the miracles which, in an ignorant and superstitious age, were attributed to many who had a reputation for piety,.",-0.0005106730350391744,0.2160823241973007,-0.0008922058272777728,0.19462601242847344
"In forming the Constitution the framers of our government were controlled by the principle that the powers which belong to all governments can be most safely and satisfactorily exercised by dividing them according to their nature among three separate branches, the executive, the legislative, and the judicial.","In forming the Constitution the principle that the powers which belong to all governments can be most safely and satisfactorily exercised by dividing them according to their nature among three separate branches, the executive, the legislative, and the judicial controlled the framers of our government.",0.003077453126616413,-0.00708753073803689,-0.0013880642236489373,-0.1231690738414769
"But this interval of waiting was abridged by the hope that after a Silence-Cure of eight days in Hamburg, five weeks of simple imprisonment at Rügen, and a week of the Nethermost hell at Fünen, he would see his wife again.","But the hope that after a silence - cure of eight days in Hamburg, five weeks of simple imprisonment at Rügen, and a week of the Nethermost hell at Fünen, he would see his wife again abridged this interval of waiting.",-0.004015146117167237,-0.02877212945776946,-0.007685730671494756,-0.10558248351592965
"They were met by David himself, seated in the foyer by the side of Helen, who looked white and frightened.","David himself, met them seated in the foyer by the side of Helen, who looked white and frightened.",0.0062398235226483086,0.13231904767140484,0.003631423922051277,0.10045359216731918
And once the adventure was undertaken by a hero who had enjoyed very little peace or rest since he came into the world.,And once a hero who had enjoyed very little peace or rest since he came into the world undertook the adventure.,0.0015893982039577807,0.09202196067739722,-0.0014765415247499321,0.07869471921407918
"Now as it happens, the end member is easily selected by the monkey, and it appears further that alternation was relatively easy for Sobke to acquire.","Now as it happens, the monkey easily selects the end member, and it appears further that alternation was relatively easy for Sobke to acquire.",0.0007110756915113248,0.014695278230060758,-0.0005463737393646844,0.02406265396551606
"The connection between the balance and the escape wheel is made by a lever to which the Pallets are fastened, and into the forked end of which plays the Ruby pin which is carried on a roller on the same staff as the balance.","A lever to which the Pallets are fastened makes the connection between the balance and the escape wheel, and into the forked end of which plays the Ruby pin which is carried on a roller on the same staff as the balance.",-0.00033581264786097114,-0.12822478199783388,-0.006166491571290657,-0.11236369250679171
"In constructive design, nothing is lost by honesty.","In constructive design, honesty loses nothing.",-0.0014699109911905355,-0.01085537668912951,-0.00546546941223095,0.035240706634273804
"Before Allington can be reached, in ascending the Medway, the river is spanned by an ancient stone bridge, of pointed arches and triangular buttresses, at Aylesford.","Before Allington can be reached, in ascending the Medway, an ancient stone bridge, of pointed arches and triangular buttresses, at Aylesford spans the river.",0.0027399270025571243,-0.09897385577173107,0.001611543679686572,-0.06956102420059698
"The captain of the guard, coming to the tunnel under the grand stand, was addressed by the sentinel there.","The sentinel there addressed the captain of the guard, coming to the tunnel under the grand stand,.",0.003685289050519177,-0.004933822940466707,5.4390518603155726e-05,-0.016255957646593818
This plant will be distinguished usually by the amount of white Mycelium at the base of the stem.,The amount of white Mycelium will distinguish usually this plant at the base of the stem.,0.004035944264936203,-0.0580092128835022,0.002226412514738463,-0.02912876050719867
"Without doubt these crimes were committed by order, as German Detachments arrived in the neighborhood with their torches, their grenades, and their usual outfit for arson.","Without doubt order committed these crimes, as German Detachments arrived in the neighborhood with their torches, their grenades, and their usual outfit for arson.",0.0028161639624729386,0.1637631907932029,-0.002107155888393447,0.09660315162659683
But in this respect he was emulated by many who deem it almost a point of honour to have their granaries well supplied with the commodity.,But in this respect many who deem it almost a point of honour to have their granaries well supplied with the Commodity emulated him.,0.0019306240731245799,0.11384835765580523,-0.0030513886728378205,0.008119342403558525
"As Vance was returning from his walk he was met on the outskirts of the village by a number of this class of hangers-on, who make their living by selling town lots on Commission.","As Vance was returning from his walk a number of this class of hangers - on, who make their living by selling town lots on Commission met on the outskirts of the village him.",0.0050376846077281046,0.03366635519331014,0.002612575076734153,0.017360681202141043
"Sand and crushed Crocks or Potsherds are used by many for mixing with the potting material, but they may easily be dispensed with, or used only in very small quantities.","Many for mixing with the potting material Potsherds uses sand and crushed Crocks or, but them may easily be dispensed with, or used only in very small quantities.",0.0006743106806500411,-0.11035611529817985,0.0017847868823057211,-0.051112218184060254
These curious autographs are still preserved by the societies in London.,The societies in London still preserve these curious autographs.,0.002375832667266568,0.08619487555492687,-0.003077839807525022,0.08897761499821698
"But, by the time of the Persian wars, says Helbig, the Thracians were regarded by the Greeks as rude barbarians, and their military equipment was totally Un-Greek.","But, by the time of the Persian wars, says the Greeks regarded Helbig, the Thracians as rude barbarians, and their military equipment was totally UN - Greek.",0.003856496189753586,0.18509928960416705,0.002209645428533107,0.14201761330172535
The validity of these scores is consistently borne out by the school history.,The school history consistently bears out the validity of these scores.,0.00146571865756684,0.037861481842199146,-0.003258245738939102,0.07050009412973463
"New York is bounded on the North, South, East and West by the state of divorce!","The state of divorce bounds on the North, South, East and West New York!",-0.004024074239236725,-0.1559345798198514,-0.005015570050738935,-0.07277218523153592
"He was often shocked by the conditions about him, but lacked the moral courage to suppress them.","The conditions about he often shocked him, but lacked the moral courage to suppress them.",0.005034242113943601,0.25178463712538257,0.002548088761976931,0.23265983469149545
Donal had been taken to the place by an Amusement-Loving acquaintance who professed that a special invitation made it impossible to pass by without dropping in.,An amusement - loving acquaintance who professed that a special invitation made it impossible to pass by without dropping in had taken to the place Donal.,0.001801245803339335,0.08488420838331283,-0.004589109675353746,0.07452667501050289
This was accomplished by means of ropes hitched to the thirty though the runabout had sunk almost out of sight.,Means of ropes hitched to the thirty though the runabout had sunk almost out of sight accomplished this.,0.003161516026530557,0.11473263780580614,3.613296905534912e-05,0.17960019554264986
"His absence from the city, which he alludes to, may have been caused by his interests in Philadelphia, where at that time he had a tavern in water street, in front of which he hung out the sign of Queen Charlotte, the same as at his New York house.","His interests in Philadelphia, where at that time he had a tavern in water street,, may have caused his absence from the city, he alludes which to in front of which he hung out the sign of Queen Charlotte, the same as at his New York house.",0.005125500674152305,0.09688372633736617,0.00331295418663275,0.056997397144113796
"A reward of £200 was offered by government, but the offender was never apprehended.","Government offered a reward of £ 200, but the offender was never apprehended.",0.005724569609932784,0.12036940252508696,0.004458454461326697,0.14411212497708603
Mary was excited by the story Tom told her in the Nestor sitting room.,The story Tom told her in the Nestor sitting room excited Mary.,0.002042973569627538,0.10772370065457022,-0.0008523708824808751,0.06408450478870562
"When the boy was twelve years old, his father was ordered by the Genoese to leave the island.","When the boy was twelve years old, the Genoese ordered his father to leave the island.",0.008955606824874538,0.11500361988227817,0.007492279132650385,0.12745082755617998
"For the rest its roof was supported by massive columns, and on one side there was a second door that led to a prison cell.","For the rest massive columns supported its roof, and on one side there was a second door that led to a prison cell.",0.004826658352445069,0.0780101132105305,0.0023379290520662626,0.05023787149431004
"It is sold by the million bottles, and yet it is nothing but a little Paregoric dropped in some sweet mixture.","The million bottles sell it, and yet it is nothing but a little Paregoric dropped in some sweet mixture.",0.002580428686448571,-0.06263859776700793,-0.0023791904411918745,-0.0378963494849604
The Sensualist who is not deterred from excess by these considerations will be completely careless whether his indulgence results in children or Not—He is moved by his selfish impulses alone.,The Sensualist who is not deterred from excess by these considerations will be completely careless whether his indulgence results in children or not — his selfish impulses alone move him.,-0.008496304341893954,-0.10985100290636937,-0.009102058317032374,-0.09250386890190322
"He had been assured by the rose that these luxuries were not for little boys, and he had been willing to wait.","The rose had assured him that these luxuries were not for little boys, and he had been willing to wait.",0.0009883380444166443,0.2293050048544969,-1.8993901453884872e-05,0.23086299628881787
"Notwithstanding the growth of the service together with the added work of the postal savings system and the parcel post, the Department service in Washington has been reduced by 200, with a resultant saving of over $166,000 per annum because of the adoption of methods of operation which develop efficiency, and permit the changes so necessary to progressive improvement.","Notwithstanding the growth of the service together with the added work of the postal savings system and the parcel post, 200 has reduced the Department service in Washington, with a resultant saving of over $166,000 per annum because of the adoption of methods of operation which develop efficiency, and permit the changes so necessary to progressive improvement.",-5.238368420329258e-06,0.012553349010739085,-0.002158779946642947,0.015973235288897828
"A Manifesto was at once issued by the Republican members, complaining that the sovereign power was in the hands of men opposed to all reforms, but predicting a certain victory as the fruit of Union, perseverance, and Devotedness on the part of the people.","The Republican members at once issued a Manifesto, complaining that the sovereign power was in the hands of men opposed to all reforms, but predicting a certain victory as the fruit of Union, perseverance, and Devotedness on the part of the people.",-0.0026714623551692606,0.09019142763618027,-0.005290233523275986,0.07839718683773364
Every Mountain-Pass and weak point was defended by a fortified tower.,A fortified tower defended every mountain - pass and weak point.,0.004052867028100739,0.03799823303617598,-0.0009453628229061116,-0.0614192461630669
"Upon examining the bow of his speed boat George had found where that bullet had struck, that was fired last of all by the desperate Smuggler, in hopes of frightening the boy at the wheel of the pursuing craft.","Upon examining the bow of his speed boat George had found where that bullet had struck, the desperate Smuggler fired last of all that, in hopes of frightening the boy at the wheel of the pursuing craft.",-0.008908407456606702,-0.00014285017128962824,-0.010050189075979349,0.010159768807570232
What is being done by our missions today to make that consummation possible and desirable at the earliest moment?,Our missions are doing what today to make that consummation possible and desirable at the earliest moment?,-0.002477354336076749,-0.027763325475532036,-0.005564533739419397,-0.033173732546944654
This is sufficiently demonstrated by experience.,Experience sufficiently demonstrates this.,-0.012260509340609108,-0.047334641605969785,-0.01829478620258146,-0.12343810897506867
"Hence, when the discharge or spark takes place between the spark balls, the rapid movement of the electrons in the wire is accompanied by a redistribution and movement of the lines of strain outside.","Hence, when the discharge or spark takes place between the spark balls, a redistribution and movement of the lines of strain outside accompanies the rapid movement of the electrons in the wire.",-0.0017842169911682457,0.0792980834491418,-0.001271761975993126,0.09191886712567832
The general atmosphere of the room was permeated by an odor of damp toast and the stale fumes of asthma cigarettes.,An odor of damp toast and the stale fumes of asthma cigarettes permeated the general atmosphere of the room.,0.0001557933225352575,0.11575766276647409,-0.005849627090962454,0.017476504868348966
"The peace, which Adrian had concluded with the King of Sicily, was soon seized by Frederic Barbarossa as the pretext for a new quarrel with the church.","Frederic Barbarossa soon seized the peace, which Adrian had concluded with the King of Sicily, as the pretext for a new quarrel with the church.",-0.001412077734605472,0.05826030290131912,-0.0030752624490757094,0.05307523462798326
But I am sent into this Chamber by my constituents and not by Governor James N. Gillett.,But my constituents send into this Chamber me and not by Governor James N. Gillett.,-0.0019130323402317684,-0.12790077062194466,-0.005175957658596315,-0.10878946937518919
"The variety may also be known by the Downiness of the young leaves, the Calyx-Tube, and the stalks.","The Downiness of the young leaves also may know the variety, the Calyx - tube, and the stalks.",0.002976176700908466,0.029825381530248444,0.0006366116197923644,0.04133660879045078
And it was approached by a well timbered roadway of split green logs.,And a well timbered roadway of split green logs approached it.,0.002189575526478411,0.09024345042559767,-0.0008242599066312795,0.09192112378869709
"The shedding of his first crop of hair was followed by a darker down, revealing Jane.","A darker down followed the shedding of his first crop of hair, revealing Jane.",-0.002886768986604368,0.07509099052974992,-0.0048387561209232415,0.01964680828374988
All these words had been spoken by Jeanne with feverish vivacity.,Jeanne had spoken all these words with feverish vivacity.,-0.00415037400519172,0.050051443674831705,-0.007327874052317548,0.015760360114762634
This Ebook was produced by Joel Erickson,Joel Erickson produced this Ebook,-0.002930096402857946,-0.10318682869685196,-0.004802825156000548,-0.10348331460323659
"The fifth Australian division was relieved on August 1ST by a division of the third Corps, in that part of the Corps front which lay north of the Somme, and passed into Corps reserve, in a rear area, there to undergo training with tanks, and to prepare itself for the work which it had to do.","A division of the third Corps relieved on August 1ST the fifth Australian division, in that part of the Corps front which lay north of the Somme, and passed into Corps reserve, in a rear area, there to undergo training with tanks, and to prepare itself for the work it had which to do.",0.005505805324390911,-0.004371813541085699,0.0016338557067798788,-0.07016447027849858
The remainder of the day was spent by us in Reconnoitering.,We spent the remainder of the day in Reconnoitering.,0.001857905168981655,0.10086501088324877,-0.006058053279929423,-0.0322193025819343
Its claims to great antiquity are not admitted by scholars.,Scholars not admit its claims to great Antiquity.,0.007807921689763233,0.10748182087912002,0.0030869764403246205,0.16833597140393647
"The Chronometers were then wound up by me, and the thermometer, barometer, & C., registered.","I then wound up the Chronometers, and the thermometer, barometer, & C., registered.",-0.0020095857360278944,0.14014885400314334,-0.006709501959783851,0.028003238963881814
The extraordinary must be contributed by our own minds and feelings.,Our own minds and feelings must contribute the extraordinary.,-0.006062017224937066,-0.04040861279790202,-0.009896881835221907,-0.1036678157675674
This introduction was written by Daly and Carl Fleischhauer.,Daly and Carl Fleischhauer wrote this introduction.,-0.0006137668945294904,0.0036188716956123378,-0.003027826494174525,-0.015691971961988523
"In effect, then, the command status of all future Pacific amphibious operations was determined by the events of Guadalcanal.","In effect, then, the events of Guadalcanal determined the command status of all future Pacific amphibious operations.",0.0044302388600840955,0.04779572267139186,0.002124381268581864,0.03867825264975669
The eye is deluded by the Mirage.,The Mirage Deludes the eye.,-0.005025880507330872,-0.13069801520381696,-0.008591109828439894,-0.11498983768449261
"In all tariff legislation the true principle of protection is best maintained by the imposition of such duties as will equal the difference between the cost of production at home and abroad, together with a reasonable profit to American industries.","In all tariff legislation the imposition of such duties best maintains the true principle of protection as will equal the difference between the cost of production at home and abroad, together with a reasonable profit to American industries.",0.0002655941531516711,-0.009992421354001392,-0.001061942405781972,0.004482953072485814
