passive_sentence,active_sentence,passive_x_coord,passive_y_coord,active_x_coord,active_y_coord
The fruitfulness of Sequoia may be illustrated by two specimen branches one and a half and two inches in diameter on which I counted 480 cones.,Two specimen may illustrate the fruitfulness of Sequoia branches one and a half and two inches in diameter on which I counted 480 cones.,-0.0033888086486818085,0.08404184567170178,-0.004912903857481237,0.09779651896439645
"Millions are ripened annually by a single tree, and in a fruitful year the product of one of the northern groves would be enough to plant all the Mountain-Ranges of the world.","A single tree Ripens annually millions, and in a fruitful year the product of one of the northern groves would be enough to plant all the mountain - ranges of the world.",-0.0013354746640023224,0.024170740564398115,-0.004146610748251026,0.048036017988441454
"The endurance of the species is shown by its wandering occasionally out over the lava Plains with the yellow pine, and climbing Moraineless Mountain-Sides with the dwarf pine, clinging to any chance support in Rifts and crevices of Storm-Beaten Rocks—Always, however, showing the effects of such hardships in every feature.","Its wandering shows the endurance of the species occasionally out over the lava Plains with the yellow pine, and climbing Moraineless mountain - sides with the dwarf pine, clinging to any chance support in Rifts and crevices of storm - beaten rocks — always, however, showing the effects of such hardships in every feature.",-0.005482021790500733,0.12446015024114528,-0.006457905848748885,0.1441909125485146
It has evidently been derived from the coast range by way of the tangle of connecting mountains at the head of the Sacramento valley.,Way of the tangle of connecting mountains at the head of the Sacramento valley evidently has derived from the coast range it.,0.004473782721323052,0.0915425526507194,0.002525843364243766,0.03446017714126899
"How much the growth of the trees is stimulated by this means it is not easy to learn, but his action in manipulating their seeds is more appreciable.","How much this means it is not easy to learn stimulate the growth of the trees, but his action in manipulating their seeds is more appreciable.",-0.002012538048843134,-0.004536853481342536,-0.004158537892607214,-0.009564350563836458
"He is seldom killed by hunters, for he is too small to encourage much of their attention, and when pursued in settled regions becomes excessively shy, and keeps close in the furrows of the highest trunks, many of which are of the same color as himself.","Hunters seldom kill him, for he is too small to encourage much of their attention, and when pursued in settled regions becomes excessively shy, and keeps close in the furrows of the highest trunks, many of which are of the same color as himself.",0.0015035736545623546,-0.04517725350733259,-0.0007468898207900309,-0.05049443278823679
"Occasionally he is pursued by hawks and Wildcats, etc.","Occasionally hawks and Wildcats, etc pursue him.",-0.006911029261912853,0.041593413866723855,-0.01203562966403009,0.04178337162150944
"The other Alpine Conifers—The needle pine, mountain pine, Two-Leaved pine, and Hemlock Spruce—Are never thinned out by this agent to any destructive extent, on account of their admirable toughness and the closeness of their growth.","This agent never Thins out the other Alpine Conifers — the needle pine, mountain pine, two - Leaved pine, and Hemlock Spruce — to any destructive extent, on account of their admirable toughness and the closeness of their growth.",0.002920243155750241,-0.05068719033104513,-0.0003690847427297076,-0.01593738562777406
The Sierra rivers are flooded every spring by the melting of the snow as regularly as the famous old Nile.,The melting of the snow floods every spring the Sierra rivers as regularly as the famous old Nile.,0.0011137752206794524,0.02911466239080713,-0.003440923226800348,0.09379231472684557
"The Destructiveness of the lower portion of this particular flood was somewhat augmented by mining gravel in the river channels, and by levees which gave way after having at first restrained and held back the accumulating waters.","Mining gravel in the river channels somewhat augmented the Destructiveness of the lower portion of this particular flood, and by levees which gave way after having at first restrained and held back the accumulating waters.",0.007244910582084276,0.0020041865940144954,0.0027233665269595702,0.058822492851759334
"When, therefore, we attempt to study them from the valleys, or from gaps and openings of the forest, we are confounded by a multitude of separate and apparently antagonistic impressions.","When, therefore, we attempt to study them from the valleys, or from gaps and openings of the forest, a multitude of separate and apparently antagonistic impressions Confounds us.",-0.008159726600396468,0.09778189243304462,-0.011112382377602922,0.14441821958880488
"No harsh lines are presented by any portion of the nest as seen in place, but when removed from its shelf, the back and bottom, and sometimes a portion of the top, is found quite sharply angular, because it is made to conform to the surface of the rock upon which and against which it is built, the little architect always taking advantage of slight crevices and Protuberances that may chance to offer, to render his structure stable by means of a kind of gripping and Dovetailing.","Any portion of the nest presents no harsh lines as seen in place, but when removed from its shelf, the back and bottom, and sometimes a portion of the top, is found quite sharply angular, because it is made to conform to the surface of the rock upon which and against which it is built, the little architect always taking advantage of slight crevices and Protuberances that may chance to offer, to render his structure stable by means of a kind of gripping and Dovetailing.",-6.182759392824814e-05,0.11551292409915578,-0.0016825176684270627,0.13178394531744542
"Nearly all the lofty Mountain-Chains of the globe are inhabited by wild sheep, most of which, on account of the remote and all but inaccessible regions where they dwell, are imperfectly known as yet.","Wild sheep, most of which inhabit nearly all the lofty mountain - chains of the globe, on account of the remote and all but inaccessible regions where they dwell, are imperfectly known as yet.",-0.0017830475467300669,0.045832608693422594,-0.004161616417731698,0.05141745082149814
"The antelope, though not a Mountaineer, is occasionally met in winter by the sheep while feeding along the edges of the Sage-Plains and bare volcanic hills to the east of the Sierra.","The sheep occasionally meet in winter the antelope, though not a Mountaineer, while feeding along the edges of the Sage - Plains and bare volcanic hills to the east of the Sierra.",-0.0012333390746047308,0.05832904772954203,-0.003165359305243678,0.03359363314121604
"Should the dip of this ancient channel be such as to make the Stanislaus Cañon available as a dump, then the grand deposit might be worked by the Hydraulic method, and although a long, expensive tunnel would be required, the scheme might still prove profitable, for there is “ millions in it . ”","Should the dip of this ancient channel be such as to make the Stanislaus Cañon available as a dump, then the Hydraulic method might work the grand deposit, and although a long, expensive tunnel would be required, the scheme might still prove profitable, for there is “ millions in it . ”",0.003040364526566157,-0.08722626392856501,0.002884048787407228,-0.08523159476895781
"These secluded flats are settled mostly by Italians and Germans, who plant a few vegetables and Grape-Vines at odd times, while their main business is mining and prospecting.","Mostly Italians and Germans, who plant a few vegetables and grape - vines at odd times settle these secluded flats, while their main business is mining and prospecting.",-0.0007296167670688082,0.06229913831845595,-0.00604058210109383,0.1047058780093779
"Their beauty is thrust upon them by exuberant nature, apart from which they are only a few logs and boards rudely jointed and without either ceiling or floor, a rough fireplace with corresponding cooking utensils, a Shelf-Bed, and stool.","Exuberant nature thrusts upon them their beauty, apart from which they are only a few logs and boards rudely jointed and without either ceiling or floor, a rough fireplace with corresponding cooking utensils, a shelf - bed, and stool.",-0.006729958885190151,0.1789039067355164,-0.012982457780569294,0.2360477744752175
"Arriving at the one House of this One-House city, we were Boisterously welcomed by three drunken men who had come to town to hold a spree.","Arriving at the one House of this one - house city, three drunken men who had come to town to hold a spree Boisterously welcomed us.",-0.002938572593328051,-0.044713697245608044,-0.005015162406093967,-0.013707700590627338
"Other Importations were made, from time to time, by way of the Isthmus, and, though great pains were taken to insure success, about one half usually died on the way.","Way of the Isthmus made, from time to time, other Importations, and, though great pains were taken to insure success, about one half usually died on the way.",0.0038920741378925343,-0.03573169472287272,0.000166053435895309,0.008161553352646116
"The base of this Arctic region is Girdled by a belt of crumbling lava measuring about 1000 feet in vertical breadth, and is mostly free from snow in summer.","A belt of crumbling lava measuring about 1000 feet in vertical breadth Girdles the base of this Arctic region, and is mostly free from snow in summer.",0.0024429805662298915,0.08967496735046575,-0.0019312653771565353,0.14891833639796614
For 100 feet or so above the fall the ascent was made possible only by tough cushions of Club-Moss that clung to the rock.,For 100 feet or so above the fall only tough cushions of club - Moss that clung to the rock made the ascent possible.,0.003031203728714591,-0.028751980136758712,-0.0012998508132678378,-0.007916413792108152
"Moreover, it is acted by the best members of the company in their very best manner.","Moreover, the best members of the company act it in their very best manner.",-0.004209901952158118,0.13527439760537688,-0.006393495337248251,0.06276095041466903
Her whole frame was Agitated by a secret struggle.,A secret struggle Agitated her whole frame.,-0.004273435150745575,-0.027854245564291055,-0.013242331122004299,0.12204096998888775
Such a man could not be viewed by Senators with any other feelings than those of horror and disgust.,Senators not could view such a man with any other feelings than those of horror and disgust.,-0.0018537928254938351,-0.016980059045521887,-0.0029870182490969828,-0.035737830041674315
"He had been visited by delegations from the great heart of the nation, who assured him that the great heart of the nation yearned for an immediate increase of the duty on various articles which competed with the articles manufactured by the members of the delegation.","Delegations from the great heart of the nation, who assured him that the great heart of the nation yearned for an immediate increase of the duty on various articles which competed with the articles manufactured by the members of the delegation had visited him.",-0.0002781730770293608,0.01191133466354546,-0.0039456231267755645,0.07230498877336232
The stock should be heated by a slow fire until the sap starts.,A slow fire should heat the stock until the sap starts.,-0.0020571273783049357,0.010587455240880117,-0.00691019291236279,0.029480674555100745
"The catastrophe was witnessed by the assembled family, who hastened to the bleeding victims of parental injustice, and endeavored to do all that was possible to restore life to the mangled forms of the two who loved when living, and in death were not divided.","The assembled family, who hastened to the bleeding victims of parental injustice, and endeavored to do all that was possible to restore life to the mangled forms of the two who loved when living witnessed the catastrophe, and in death were not divided.",-0.0020592093330549406,0.021912822159740126,-0.0044283855935776766,0.05822885993482254
"Whether he had been drawn to that place by some one of the many mystic influences moulding the fates of men, or because it happened to be on his usual way home, let students of psychology and topography decide.","Whether some one of the many mystic influences moulding the fates of men had drawn to that place him, or because it happened to be on his usual way home, let students of psychology and topography decide.",-0.0015697807753807162,-0.04611874413419062,-0.004956056765576678,-0.011373845770047386
Everything belonging to the Colonel is held in the utmost awe by the villagers.,The villagers hold in the utmost awe everything belonging to the colonel.,-0.0053774535504778525,0.09290045795279736,-0.0076991896204410566,0.041383409786986555
"He was informed by Mr. Tubbs that he would fall down dead, or else get killed by stones or clubs, with that thing in his head.","Mr. Tubbs informed him that he would fall down dead, or else get killed by stones or clubs, with that thing in his head.",-0.0021643245015054696,-0.01845665896741324,-0.00722389492076395,0.039184642467035846
"History has indeed been illustrated by American art, but has it been enriched?","American art indeed has illustrated history, but has it been enriched?",0.0021456490139496907,0.010410259196385465,-0.0005018472925666492,0.051556398883658795
But it was missed by somebody the day after.,But somebody missed it the day after.,0.0043371555854106675,-0.1729670748587651,-9.224071285972649e-05,-0.16664681217780128
"As I slept the other night, neither dreaming nor holding psychological intercourse of any description with outsiders, I was awakened suddenly about the first hour of the morning by a noise.","As I slept the other night, neither dreaming nor holding psychological intercourse of any description with outsiders, a noise awakened suddenly about the first hour of the morning me.",-0.007044208936636536,0.03314406021290708,-0.008980504544604789,0.06844160618344804
"The annual Panther, weighing 8 ft., 9 inches, from snout to tip of tail, and measuring 213 lbs., has just been killed in the Adirondacks by a reporter.","A reporter just has killed in the Adirondacks the annual Panther, weighing 8 ft ., 9 inches, from snout to tip of tail, and measuring 213 lbs .,.",0.001804364864845622,0.019896982870996525,-0.003129555974150787,0.043208769664965535
"He would, however, be considered by most people still a young man.","Most people, however, would consider still a young man him.",0.0007407510238344769,-0.21195461311639544,-0.003342510550621394,-0.12459765503379906
"In short, I am visited nightly by an appalling apparition.","In short, an appalling apparition visits nightly me.",-0.007847248185178245,0.029937590979763458,-0.015516047607302734,0.1520063346792601
"This might only be caused by functional disturbance of the brain, but it was quite serious enough to call for immediate attention.","Functional disturbance of the brain only might cause this, but it was quite serious enough to call for immediate attention.",0.001657395237078521,-0.03519741448622461,0.0002731947485027983,-0.06344185067585989
"It was followed by a muffled cry, a crash, and a heavy fall.","A muffled cry, a crash, and a heavy fall followed it.",-0.005335319503487214,0.03697172672896018,-0.012932477211231964,0.18457283994670992
"In his Medical-Student days the sort of trick I have been playing on Sir Henry was enacted by some of his Fellow-Students for his benefit, and almost scared him into fever.","In his medical - student days some of his fellow - students enacted the sort of trick I have been playing on Sir Henry for his benefit, and almost scared him into fever.",-0.008095304914187078,0.02758184152189268,-0.009210764724866868,-0.01298000130228445
All the rest of the face and figure was completely covered by the black cloak.,The black cloak completely covered all the rest of the face and figure.,0.009375750000412629,-0.13862876846359867,0.005368300539785258,-0.09112660141730153
Here the Palace was built by William II.,Here William II built the Palace.,0.008464780776516573,-0.07559502552719832,0.0040195104583344455,-0.062309643396076655
"It was presented by the inhabitants of Amsterdam, while two silver Lustres at the sides of the fireplace were presented by Rotterdam.","The inhabitants of Amsterdam presented it, while two silver Lustres at the sides of the fireplace were presented by Rotterdam.",0.003378725695660761,0.07294258846130744,0.001221311440050067,0.09861061608283825
"A frog is ordained by nature to smile much, but the smile seems commonly one of hunger merely, though often one of Stomach-Ache.","Nature Ordains a frog to smile much, but the smile seems commonly one of hunger merely, though often one of stomach - ache.",-0.0068288259353537,0.12158597989939533,-0.008990410940588113,0.11221063187708696
In 1885 he was appointed by the crown canon Residentiary of Worcester cathedral.,In 1885 the crown canon appointed Residentiary of Worcester cathedral him.,0.0035492463128282696,-0.024886726110806112,0.0010636924754265223,-0.0037548457293226046
"It was kept by some people named Marac, whose characters were anything but good, and who had been implicated in several robberies that had taken place some years before, although the utmost efforts of the police had failed to trace any crime directly home to them.","Some people named Marac, whose characters were anything but good kept it, and who had been implicated in several robberies that had taken place some years before, although the utmost efforts of the police had failed to trace any crime directly home to them.",0.0034719287616372806,-0.06180442271514884,-0.004011798907533531,-0.011062123073764703
Sir Andrew could not be judged of by the surface.,The surface not could judge of Sir Andrew.,0.008121831127016626,-0.18279122964377387,0.0024848753296693943,-0.14653456980770185
"These would be answered by return, except where minute directions were inclosed.","Return would answer these, except where minute directions were inclosed.",0.006068818585313223,-0.15734238723992933,0.0012812381869539977,-0.12897636799090106
Any attempt to escape is quickly ended by the pain to which the officer who holds the instrument can inflict by a mere turn of his hand.,The pain to which the officer who holds the instrument can inflict by a mere turn of his hand quickly ends any attempt to escape.,-0.005800624815130672,0.007016247491744898,-0.012004897437530748,0.15509011361804753
"Expert thieves have been known to open handcuffs without a key, by means of knocking the part containing the spring on a stone or hard substance.","Means of knocking the part containing the spring on a stone or hard substance have known to open handcuffs without a key, expert thieves.",-0.0009529771661243285,-0.09768378537226258,-0.008359158392821529,0.11924601763360913
The silence was broken by Andrée.,Andrée broke the silence.,-0.000146744959468879,-0.10813485066687772,-0.005690150557107887,-0.09683405590568618
"This, it appeared, was shown by the breadth between the eyes and the timbre of her voice.","The breadth between the eyes and the timbre of her voice, it appeared, showed this.",-0.0016597808808421993,0.12439083914291935,-0.006592391006342355,0.12504061207164696
"After long argument and great indecision the matter was settled by a cordial letter from Mrs Mitchell, asking them to dinner on the following Thursday, and saying she feared there had been some mistake.","After long argument and great indecision a cordial letter from Mrs Mitchell settled the matter, asking them to dinner on the following Thursday, and saying she feared there had been some mistake.",-0.004744675881738995,-0.008508380973714837,-0.005401407084233984,-0.018976641594945432
Vincy Wenham Vincy was always called by everyone simply Vincy.,Everyone simply Vincy always called Vincy Wenham Vincy.,-0.007836380511452804,-0.04990889573533189,-0.010747719161131142,-0.020118711773225932
"The note is always struck by the hostess, and she was everything that was amiable, without effort or affectation.","The hostess always strike the note, and she was everything that was amiable, without effort or affectation.",-0.003504624482432677,0.05236391826935969,-0.006413519398765386,0.006363277080870162
The first two rows of the stalls were principally occupied by middle-aged and rather elderly gentlemen.,Middle - aged and rather elderly gentlemen principally occupied the first two rows of the stalls.,0.0006853957824623358,-0.03508852838696933,-0.0051520687568376005,0.047013206393630866
Edith was thrilled by the passionate emotion she felt near her.,The passionate emotion she felt near she thrilled Edith.,-0.004498541270326445,0.022112699820267145,-0.006974270420790086,0.03131488562561404
Never in his life had he been opposed by Edith before in this way.,Never in his life Edith had opposed him before in this way.,-0.0019053142627781744,-0.1584981801949378,-0.005381808420782585,-0.1750638748367264
"Her eyes were very bright, the result of few but salt tears, the corners of her mouth were lifted by a happy smile, not the Tantalising, Half-Mocking smile he used to see.","Her eyes were very bright, a happy smile, not, the corners of her mouth lifted the Tantalising, half - mocking smile he used to see the result of few but salt tears.",-0.004923905314462475,0.0059951289630528,-0.006538792985358649,-0.0016633705964374697
Mary was helped ashore by the tall Negro who had come for her.,The tall Negro who had come for she helped ashore Mary.,0.003908433591804764,-0.10214271018408964,0.0005092903451131634,-0.04942419829994295
"She was surrounded by warriors shouting, pushing and shaking their Spears.","Warriors shouting, pushing and shaking their Spears surrounded her.",-0.004268096390820233,-0.04270233399203294,-0.00841760830157308,0.04027923268980492
On one trip the canoe in which Mary was riding was attacked by a Hippopotamus.,On one trip a Hippopotamus attacked the canoe in which Mary was riding.,-0.0002657853666748326,-0.06075887259215253,-0.0020989536542951855,-0.05318519758405762
Here Mary was greeted by a handsome young man.,Here a handsome young man greeted Mary.,-0.0037381422353416007,-0.042284730368270906,-0.005729517245226754,-0.0174196071877526
"Now they are being taken care of by native workers, but these have only little training.","Now native workers are taking them of care, but these have only little training.",0.0014660325484776955,-0.028297854665972257,-0.0018769601600056194,-0.05601568058297251
"Shortly after her trip to Akpap, Mary was honored by the King of great Britain.","Shortly after her trip to Akpap, the King of great Britain honored Mary.",0.00440407020707192,-0.1384006676960956,0.002189180904390522,-0.13693915040932442
She was chosen by him to be a member of the order of St. John of Jerusalem.,He chose her to be a member of the order of St. John of Jerusalem.,0.005785965988804841,-0.1230285907131402,0.003093315700706611,-0.13308924965373525
But the farm was reached by more open methods.,But more open methods reached the farm.,0.0057675238122345115,-0.19806170026964393,-0.0013205061117995717,-0.14720443780837336
Several years of broken health had been followed by years that were for the most part free from suffering.,Years that were for the most part free from suffering had followed several years of broken health.,0.0002488620409047538,-0.040696688692001756,-0.0005441860575161831,-0.04416989325449879
"What lady, Smocked in morning Cambric, would not be wooed by such a voice?","Such a voice, not would woo what lady, Smocked in morning Cambric?",-0.01324086317945082,0.020568980049986772,-0.014582102332140178,0.0028243720136739937
Some men who have been Roguish in their lives have been remembered by their higher accomplishments.,Their higher accomplishments have remembered some men who have been Roguish in their lives.,-0.00793071360472622,0.021516891341547065,-0.007766040829389726,-0.03740790308872489
A flashing lithograph is set by way of Testament wherever traffic turns or lingers.,Way of Testament sets a flashing lithograph traffic turns or wherever lingers.,-0.007376465662083088,0.251115045948973,-0.008610694781104912,0.07921290544269695
First the Tory party was being hard hit by the Edinburgh review and there was need of defense and retaliation.,First the Edinburgh review hard Washitting the Tory party and there was need of defense and retaliation.,0.0010320716214820963,-0.07542273511478338,-0.00446363809156909,-0.019854344965729392
Her loving tenderness to the children committed to her care and her pure gentle life were remarked by those around her before there was any thought of her dying a heroic death.,Those around she her pure gentle life remarked her loving tenderness to the children committed to her care and before there was any thought of her dying a heroic death.,-0.0039583969414455885,0.01319860702835542,-0.005859061520693217,0.030481133777007414
"The Fort was surrounded by thousands of natives, who kept up a continuous fire, and the bushes near at hand were full of Sharp-Shooters.","Thousands of natives, who kept up a continuous fire surrounded the Fort, and the bushes near at hand were full of sharp - shooters.",0.002647660450672551,-0.0507168367399965,-0.0002101816265121263,-0.0658054929739647
Such deeds are so often done by our working men that they think nothing about it.,Our working men so often do such deeds that they think nothing about it.,-0.00929146905453979,-0.023443231818903867,-0.014219458069641902,-0.00763540445836435
These nine were saved during the day by a passing vessel.,A passing vessel saved during the day these nine.,0.00010910823348584124,-0.06140853109413749,-0.006178975832825812,0.05428062388405329
