passive_sentence,active_sentence,passive_x_coord,passive_y_coord,active_x_coord,active_y_coord
Of a sudden the stillness of the night was broken into by a Tuneless and discordant Jangle of Pealing bells.,Of a sudden a Tuneless and discordant Jangle of Pealing bells broke into the stillness of the night.,0.0005730254516245084,0.05325665524909598,-0.0036316122579718073,0.03774356532879123
"The night of the fourth of April, the good folk of pleasant garden were awakened by a sudden uproar.","The night of the fourth of April, a sudden uproar awakened the good folk of pleasant garden.",-0.0002701210887243846,0.07917856032255824,-0.003667957407337442,-0.01965504704756228
The sinking of the German destroyer through the prompt decision taken by captain Loder Symonds is recognised by those who were present as having been a remarkably fine piece of work on his part.,Those who were present as having been a remarkably fine piece of work on his part recognises the sinking of the German destroyer through the prompt decision taken by captain Loder Symonds.,-0.0021274399905285317,-0.07779272224441079,-0.003718955112174476,-0.01946466400026163
"In his early period up till about 1640, Rembrandt ’ s Etching is characterised by a clear lineal manner with little tendency to the Chiaroscuro which gradually became the characteristic feature of his artistic style in Etching as well as in painting.","In his early period up till about 1640, a clear lineal manner with little tendency Characterises Rembrandt ’ s Etching to the Chiaroscuro which gradually became the characteristic feature of his artistic style in Etching as well as in painting.",0.005130845127316988,0.09470689081781873,0.00493660254095718,0.08328979832900793
"“ this wish being gratified, his last hours were soothed by the accents which of all must have been most grateful, the prayers and blessings of the poor, to whom he had been as a father in the relieving of their corporeal wants.","“ this wish being gratified, the accents which of all must have been most grateful soothed his last hours the prayers and blessings of the poor, to whom he had been as a father in the relieving of their corporeal wants,.",-0.0070483594823409716,-0.0681685078280363,-0.008064196039966304,-0.06922547475019566
Or had he been jumped somewhere by Kitchell ’ s pack of wolves and forced along for some purpose of their own?,Or Kitchell ’ s pack of wolves had jumped somewhere him and forced along for some purpose of their own?,0.007653512274507968,0.1940877554629716,0.002643802225322991,0.1973063041065531
"Patricia was so overcome by these Magnanimous words that she shook hands with great Heartiness, promising to visit Miss Merton and vowing appreciation of her kindness.","These Magnanimous words she shook hands that with great Heartiness, promising to visit Miss Merton and vowing appreciation of her kindness so overcame Patricia.",-0.008692683044016401,0.002844016644862498,-0.009922693741178233,-0.005577716802741495
"The door was closed by Gainsford, now one of the gravest of Footmen.","Gainsford, now one of the gravest of Footmen closed the door.",0.0033834558982992194,0.02619074839198359,-0.006213877120882889,-0.08895910502256005
The greatest crux is furnished by Mr. Ginnell and Mr. Pemberton-Billing.,Mr. Ginnell and Mr. Pemberton - billing furnishes the greatest crux.,-0.00472350344137042,-0.15769271358236472,-0.011009149493702203,-0.06880920221824365
The angles of Sumter are being strengthened outside by stone buttresses.,Stone buttresses are strengthening outside the angles of Sumter.,0.0014009593789573583,-0.036400326347484344,-0.0009568495339817465,-0.019474548648111222
Blue gas may be rendered luminous by the addition of some hydrocarbon that will liberate free carbon in the flame when burned.,The addition of some hydrocarbon that will liberate free carbon in the flame when burned may render blue gas luminous.,0.0004052730145615614,0.048451137391567395,-0.005576022626359474,-0.006863641019552162
"These were saved by the protests of Europe, and perhaps by the knowledge that if all the Armenians were killed, there could never be any more shooting.","The protests of Europe saved these, and perhaps by the knowledge that if all the Armenians were killed, there could never be any more shooting.",0.0038317598805672117,0.17782648747945087,-0.00024904341315778165,0.16055689293515935
"Here we were soon joined by the three who had ridden ahead, and who brought back word that the Athabasca looked ugly, but was still subsiding, and might be Fordable in the morning.","Here the three who had ridden ahead soon joined us, and who brought back word that the Athabasca looked ugly, but was still subsiding, and might be Fordable in the morning.",0.0015826031334076358,0.11639645063816564,-0.0017270527138700655,0.10237522887179162
Thus he will be totally blinded by the gold he has wrongfully helped to keep.,Thus the gold he has wrongfully helped to keep totally will blind him.,-0.005289211725878288,-0.12652718979643537,-0.007027885924400706,-0.08569357901569587
"He has been ranked by the Militär-Wochenblatt, organ of the German general staff, as one of the few strategists of first class ability among the allies.","The Militär - Wochenblatt, organ of the German general staff, has ranked him as one of the few strategists of first class ability among the allies.",-0.0039723970715570866,-0.21359622159655461,-0.007466266471668974,-0.18055671526129644
"The idea of this inventor was put into effect in 1624 by a French engineer and mathematician, Solomon de Caus.","A French engineer and mathematician, Solomon de Caus put into effect in 1624 the idea of this inventor.",0.003945713911488031,0.058641853870925055,0.0014356583177482579,0.0516786864796729
"It is said by Lossing, in his booklet on the Dover stone church, that Sacassas, the mighty Sachem of the Pequoids and Emperor over many tribes between the Thames and the Hudson River, was compelled after a disastrous battle which Annihilated his warriors, to fly for safety, and, driven from point to point, he at last found refuge in this cave, where undiscovered he Subsisted for a few days on berries, until at last he made his way through the territory of his enemies, the Mahicans, to the land of the Mohawks.","Lossing says it, in his booklet on the Dover stone church, that Sacassas, the mighty Sachem of the Pequoids and Emperor over many tribes between the Thames and the Hudson River, was compelled after a disastrous battle which Annihilated his warriors, to fly for safety, and, driven from point to point, he at last found refuge in this cave, where undiscovered he Subsisted for a few days on berries, until at last he made his way through the territory of his enemies, the Mahicans, to the land of the Mohawks.",0.003701564890440379,0.07342825160006458,0.0031421088042497,0.07859235671778195
"At the moment of his entering the Bay of Yedo, he was surrounded by Guard-Boats, and saluted with various warnings of peril, which might have deterred a less resolute man.","At the moment of his entering the Bay of Yedo, guard - boats surrounded him, and saluted with various warnings of peril, which might have deterred a less resolute man.",0.001994866656201167,0.05961241132499734,0.00036427951187107907,0.03051298665228604
"Probably the word was suggested by a question, as “ where are certain things done? ”","Probably a question suggested the word, as “ where are certain things done? ”",0.0013862155395374933,-0.01136671030919903,-0.0016878920192602176,-0.04327352578547766
"Upon the day following the occupation of the ridge a welcome accession of strength was received by the arrival of the guides, a picked Corps consisting of three troops of cavalry and six companies of infantry.","Upon the day following the occupation of the ridge the arrival of the guides, a picked Corps consisting of three troops of cavalry and six companies of infantry received a welcome accession of strength.",7.021141979222803e-05,0.020058493831586685,-0.001409522112144153,0.032627195442421465
He was succeeded by Charles Gustavus Wrangel.,Charles Gustavus Wrangel succeeded him.,0.005060234949369771,0.04137435494299639,0.0008890759517859638,0.05268123734432478
"It was done by means of an extremely faint humming device, reminding the geologist of certain Wireless Apparata he had heard.","Means of an extremely faint humming device did it, reminding the geologist of certain Wireless Apparata he had heard.",-0.003475839142948266,-0.004471941228477625,-0.007721201055052197,0.03918050894677694
"The paper was first cited by DOM Calmet, among the documents in his ‘ Histoire de Lorraine . ’","Dom Calmet first cited the paper, among the documents in his ‘ Histoire de Lorraine . ’",0.0043032854505723195,0.10548370598815981,0.0020248794531135504,0.0865620607942304
"All seven were given to me by my friend, but as I could wear but six, I returned to her this odd Shakespeare button, which I had made into a Breast-Pin, and kept the others, thus reducing the set of buttons to six.","My friend gave to me all seven, but as I could wear but six, I returned to her this odd Shakespeare button, which I had made into a breast - pin, and kept the others, thus reducing the set of buttons to six.",-0.005860467853152771,0.056274046451706666,-0.00956207445654192,0.019989946118348957
If so it would have been covered by the ten to twenty feet rise of the Nile deposits since the time of its former use.,If so the ten to twenty feet rise of the Nile deposits would have covered it since the time of its former use.,0.011759349772646536,0.07966231684741612,0.008787202216974101,0.07474324299254044
"The main building, one story in height but perhaps a hundred feet long, was surmounted by lofty Gables and a very steep roof, built thus to shed the snow and to give a roomy attic for Bed-Chambers.","Lofty Gables and a very steep roof, built thus to shed the snow and to give a roomy attic for bed - chambers surmounted the main building, one story in height but perhaps a hundred feet long,.",0.004992945140929477,-0.01530121568546465,-0.003038943728238081,-0.07217958776205106
"A most cordial reception was accorded us by Mr. Julius Mosenthal, the Austrian Consul, and the head of one of the leading Mercantile firms of the colony.","Mr. Julius Mosenthal, the Austrian Consul, and the head of one of the leading Mercantile firms of the colony accorded a most cordial reception us.",0.0005311098572289331,0.05315974803152573,-0.002342672093752169,0.009932586677951256
"The method itself was discovered by M. Raoult, and finally perfected by him in 1886, but up to the present has been but little utilized by chemists.","M. Raoult discovered the method itself, and finally perfected by he in 1886, but up to the present has been but little utilized by chemists.",0.006405780873120923,0.007132801663547829,0.003787539941770644,0.018419392444921516
The mast was stayed by a wire stretched from the head to an eye bolt at the fore end of the backbone.,A wire stretched from the head to an eye bolt at the fore end of the backbone stayed the mast.,0.0053930366159245105,0.06553964396348322,-0.0007757547976553259,0.02422639125472164
"The soil had long been prepared for it by the works of Charles Lyell, another English naturalist, whose views are of great importance for the natural history of creation, and must Accordingly here be briefly explained.","The works of Charles Lyell, another English naturalist, whose views are of great importance for the natural history of creation long had prepared for it the soil, and must Accordingly here be briefly explained.",0.0050710697179397815,0.012592735104035893,0.0013280285970252398,-0.005976579891448338
"The same crest would have been borne for a time by the son of Lord Moira, Francis Rawdon-Hastings, who was an eminent soldier.","The son of Lord Moira, Francis Rawdon - Hastings, who was an eminent soldier would have born for a time the same crest.",0.004240197607898696,-0.0013411914696692673,-0.0004514098200280571,-0.07208330272857048
The end of mark in the Sinaitic was actually written by the same Scribe as the man who wrote the New Testament in the Vatican MS.,The same Scribe as the man who wrote the New Testament in the Vatican MS actually wrote the end of mark in the Sinaitic.,0.00649765454820775,0.14116443578775234,0.0022290354272843016,0.09541439218929464
"This pretty little, and very useful insect, is tenderly regarded by our children.","Our children tenderly regard this pretty little, and very useful insect,.",-0.006912309297344099,-0.16220947027840776,-0.008271137377581509,-0.15445168662104303
His domestic fabric was disfigured by none of the isolation and squalor which so often attend the confirmed Celibate.,None of the isolation and squalor which so often attend the confirmed Celibate disfigured his domestic fabric.,0.00459505350326868,0.0852431603721544,-0.00211359886426362,-0.038473551155655414
"Formerly the masses were not regarded by the ruling class as having any capacity for political affairs, or right to Criticise governmental policies and methods.","Formerly the ruling class not regarded the masses as having any capacity for political affairs, or right to Criticise governmental policies and methods.",0.008866266417213978,0.19347044491635731,0.0007513560570167744,-0.006150970264714764
These facts were given by an eye witness who afterwards took the revolver from Leonard.,An eye witness who afterwards took the revolver from Leonard gave these facts.,0.0012586458065105442,0.14524173907785048,-0.003166760893765372,0.11814052665509753
"He was now surrounded by a crowd of foreigners, all Jabbering and gesticulating as hard as possible.","A crowd of foreigners now surrounded him, all Jabbering and gesticulating as hard as possible.",-0.0013503466762077188,0.04661478600822939,-0.006033719551858691,-0.08280980497195747
Their feet were protected by moccasins made of thin Deerskin.,Moccasins made of thin Deerskin protected their feet.,0.004012883658470229,0.11648208784097665,-0.0011685972420744013,-0.006560931916134775
"Each one will be driven by a Kafir, who most likely will be walking alongside his team.","A Kafir, who most likely will be walking alongside his team will drive each one.",-0.009620174887526981,-0.18785177720701116,-0.01457264200601973,-0.24332078889768147
"Given the brain, only, of a number of infants of the same age, weight, etc., could the sex be determined by the difference in shape, quantity, quality, and Convolutions?","Given the brain, only, of a number of infants of the same age, weight, etc ., the difference in shape, quantity, quality, and Convolutions could determine the sex?",0.00034364073683870386,0.000581084078607982,-0.0022456371274032854,0.002714370607924555
"Addresses were made on that occasion by Judge D. C. Richardson, Mayor Richard M. Taylor, Gov . Chas.","Judge D. C. Richardson, Mayor Richard M. Taylor, Gov . Chas made on that occasion addresses.",0.0001538025954501217,-0.005521809301434562,-0.005513530262264421,-0.11568988676841054
This is prescribed not only by taste but by consideration for others who may be present and who may be of more limited means.,Not only taste but by consideration for others who may be present and who may be of more limited means prescribes this.,-0.004144492566866253,-0.13571938706742478,-0.009471525532215405,-0.04728562148610985
"After the plaster has set long enough to harden, the molds are opened by gentle prying or tapping with a wooden wedge.","After the plaster has set long enough to harden, gentle prying opens the molds or tapping with a wooden wedge.",0.0031046688173286957,-0.059034164160033854,-0.00027496033301555945,-0.071285465454372
This land is divided by the father amongst his several sons.,The father divides this land amongst his several sons.,0.0014420761063482267,-0.09034877816816163,-0.0005720238014819298,-0.04173987912751762
{40A} in 1824 a duel was interrupted by the police.,{40A} in 1824 the police interrupted a duel.,-0.00111199682552571,0.10104703347203572,-0.004033483388338551,0.07378385486381342
The larger percentage of phosphorus in the lower grades is suggested by the analyst to indicate their greater food value in this respect.,The analyst suggests the larger percentage of phosphorus in the lower grades to indicate their greater food value in this respect.,-0.003149234518121615,0.0367926796434381,-0.0029742309763428603,0.08150254832208591
"Order was kept during school hours by the Bible-Clerk and Ostiarius, two of the Præfects, who held these offices in Rotation—The former lasting for a week, the latter for one day only.","The Bible - clerk and Ostiarius kept during school hours order two of the Præfects, who held these offices in rotation — the former lasting for a week, the latter for one day only,.",0.007894102518816963,0.16889851574249132,0.004309622171773004,0.13665542657513172
"All the stained-glass windows in this aisle were presented to the church by the Rev . C.W . grove, in 1888, as a memorial to his wife.","The Rev . C.W . grove presented to the church all the stained - glass windows in this aisle, in 1888, as a memorial to his wife.",0.006818557049535093,0.08252318567296009,0.005512072343161229,0.06783135977308227
She was followed by Locke.,Locke followed her.,0.001265044156062136,0.016521516590483655,-0.003591639184116999,0.0179034421886231
"He was subjected to a severe cross-examination by Mr. Rolland, but his testimony remained Unshaken.","Mr. Rolland subjected to a severe cross - examination him, but his testimony remained Unshaken.",0.002143779707199955,0.07735685357446624,2.13101209206e-05,0.0656823637096919
"Cowpeas were formerly gathered by hand, but such a method is of course slow and expensive.","Hand formerly gathered Cowpeas, but such a method is of course slow and expensive.",0.004819021143713325,0.05618805248592562,-0.004683131386082945,-0.13228828798213438
"The rotation of Saturn was discovered by Herschel in 1789, and that of mercury by Schroeter in 1800.","Herschel discovered the rotation of Saturn in 1789, and that of mercury by Schroeter in 1800.",0.007380755199328456,0.07127542452553656,0.002820163020901487,0.04084600973134697
"Its glories were sadly obscured by wet and damp, and the painting and gilding on the outside looked cold and dull.","Wet and damp sadly obscured its glories, and the painting and gilding on the outside looked cold and dull.",0.006115469364724991,0.1475020271663281,0.0019010299656280598,0.07896240584230727
"Fenella, the dumb girl of Portici, has been seduced by Alfonso, the son of the Spanish Viceroy of Naples.","Alfonso, the son of the Spanish Viceroy of Naples has seduced Fenella, the dumb girl of Portici,.",-0.0027975129596090895,-0.08107058257231738,-0.0034583225157164476,-0.0750482465659991
"Grantley hall is now owned by Sir Christopher Furness, M.P.","Sir Christopher Furness, M.P . Now own Grantley hall",0.0027749250039082888,-0.12057604981739015,-0.0011854902996296262,-0.12613949200475905
Some Jugglery was played by the adept male heart in these later Hesitations.,The adept male heart played some Jugglery in these later Hesitations.,-0.00243223147544702,0.05119502381338434,-0.004115180861544106,0.04218595303812987
"It was followed by other similar works and the series has continued in unbroken course for three centuries, through Monteverde, Carissimi, A. Scarlatti, down to our own time.","Other similar works followed it and the series has continued in unbroken course for three centuries, through Monteverde, Carissimi, A. Scarlatti, down to our own time.",0.0006063654502274651,-0.03227405377834363,-0.0022239589787904483,-0.06674001561751279
"The mouth of the Bay was protected by two fine forts, heavily armed, Morgan and Gaines.","Two fine forts, heavily armed, Morgan and Gaines protected the mouth of the Bay.",0.0034112724617114294,0.10343533580061988,-0.0007415330802824513,0.0711235728332619
"The flow of lava which follows violent Eruptions is expelled by the outward and upward force of the great internal heat, through the opening made by the steam which precedes it.","The outward and upward force of the great internal heat Expels the flow of lava which follows violent Eruptions, through the opening made by the steam which precedes it.",0.0004085791486190442,-0.08462945267924642,-0.001191769541436795,-0.003952532570862158
The “ privations ” which she supposedly endured in France were greatly exaggerated by Dumas.,Dumas greatly exaggerated the “ privations ” which she supposedly endured in France.,-0.000690472906061847,0.08855068982357549,-0.0030494085374616073,0.07972719062329589
At the door he was met by the Countess.,At the door the Countess met him.,-8.762732498918016e-06,-0.009643338682615521,-0.004832775934919329,-0.04359970283840782
Bulgarian feudalism was replaced by Byzantine feudalism.,Byzantine feudalism replaced Bulgarian feudalism.,0.0010753232601383098,0.14582850399175262,-0.0016481162094256143,0.1445735053488602
"The railway route is bordered by an apparently almost impenetrable jungle, the few settlements are widely separated, and population is sparse, seeming to be chiefly Negroes dressed in Ancient-Looking clothing ornamented with patches.","An apparently almost impenetrable jungle borders the railway route, the few settlements are widely separated, and population is sparse, seeming to be chiefly Negroes dressed in ancient - looking clothing ornamented with patches.",0.004951867558775008,0.04866888724206196,0.0006149086156188218,0.04880676848916762
"However, his jacket was still Distended by something he carried in or under it, some bit of bread, no doubt, which he meant to take home with him.","However, something he carried in or under it still Distended his jacket, some bit of bread, no doubt, he meant which to take home with him.",0.0038930843601241395,0.14936179730977261,0.00019276026265824687,0.11465126140580578
"I was perplexed by his nervousness at first, but after much pondering reasoned it out, to my own satisfaction at least.","His nervousness perplexed me at first, but after much pondering reasoned it out, to my own satisfaction at least.",-0.0036414419209396557,0.042072194487848824,-0.008599035995286105,0.021658441487370575
"They are then held up by the heels, head downward, in order to drain off the water they have swallowed, the one who first recovers consciousness being declared the Victor and awarded the hand of the lady fair.","The heels then hold up them, head downward, in order to drain off the water they have swallowed, the one who first recovers consciousness being declared the Victor and awarded the hand of the lady fair.",-0.0028723748898491644,-0.14523593943660978,-0.006598251977435478,-0.15122254269814744
"My solitary industry was enlivened by the neighbourhood of countless nesting birds, snow Buntings, little Auks, and Guillemots, whose home is in the cliffs.","The neighbourhood of countless nesting birds, snow Buntings, little Auks, and Guillemots, whose home is in the cliffs enlivened my solitary industry.",-0.0009392388481968075,0.030052304198980848,-0.00826794225120443,-0.08701546904053634
"This has recently been confirmed by Mr. E. G. green, government entomologist, at the Botanic gardens at Peradeniya, Ceylon.","Mr. E. G. green, government entomologist, recently has confirmed this at the Botanic gardens at Peradeniya, Ceylon.",0.0012059424410855945,-0.09892583559702411,8.496715792019095e-05,-0.11746243983145155
I was assisted by my family only and it stands on the record in the books of the settlement that my labors were not sustained by my Associates.,My family assisted me only and it stands on the record in the books of the settlement that my labors were not sustained by my Associates.,0.005911305397386358,0.17035782905097724,0.003665089924996327,0.15524186195873077
"At the last anniversary festival the sermon was preached by the dean of St. Paul ’ s, the text being selected from Luke IV . 16.","At the last anniversary festival the dean of St. Paul ’ s preached the sermon, the text being selected from Luke IV.",0.0002799633485441296,0.018934325539303465,-0.0019166304316284267,-0.017986780936853075
“ I was merely amused by my own speculations . ”,“ my own speculations merely amused me . ”,-0.007505786890667918,0.08990566520470109,-0.012097744960197637,0.011297697589471412
"A father, pursuing his daughter and her lover, was stopped by a Troll, and offered drink in it.","A Troll stopped a father, pursuing his daughter and her lover,, and offered drink in it.",-0.00955593664773303,-0.040633070587942875,-0.012680028898591886,-0.045483570016413954
The circumstances of Claverhouse ’ s wooing were not overlooked by his enemies and Ill-Wishers.,His enemies and ill - Wishers not overlooked the circumstances of Claverhouse ’ s wooing.,0.006549452706804982,0.2291854264955658,-0.00291096276246408,0.04911724853695911
"It was headed by Lieutenant Colonel Percy black, who began auspiciously by putting Dr. Edwin Guthrie in office as his senior psychological adviser.","Lieutenant Colonel Percy black, who began auspiciously by putting Dr. Edwin Guthrie in office as his senior psychological adviser headed it.",0.002887362895994146,0.01174986390380038,-0.00046854024853043076,0.004639769878116132
"Snaith, who had rushed at Jack with raised fists, was met by another Left-Hander that again sent him to the ground.","Another left - hander that again sent him to the ground met Snaith, who had rushed at Jack with raised fists,.",0.0022188148604864307,0.066830617690025,0.0001888299452338614,0.03664096626827485
"The roar of the guns, eighty miles away, was distinctly heard by us.","We, distinctly heard the roar of the guns, eighty miles away.",-0.0010189246693154983,0.0673501461094579,-0.002632808443106079,0.001571730869765954
