passive_sentence,active_sentence,passive_x_coord,passive_y_coord,active_x_coord,active_y_coord
"That morning grace was awakened by the sound of voices in distress, and dressing quickly she sought her father.","That morning the sound of voices in distress awakened grace, and dressing quickly she sought her father.",-0.004736206733551849,-0.024142881975917827,-0.008745146820178667,0.010240703426777142
The passage to the North Pole is barred by ice fields and guarded by frost and snow more securely than Cerberus guarded the approach to the kingdom of Pluto.,Ice fields bar the passage to the North Pole and guarded by frost and snow more securely than Cerberus guarded the approach to the kingdom of Pluto.,0.006236420575214952,-0.0763876155223647,-0.0005306986504408783,0.012062326662958811
"They were last seen by a Whaler on the 26th of July that year, and then for years no word of their fate reached great Britain.","A Whaler on the 26th of July last saw them that year, and then for years no word of their fate reached great Britain.",0.006691488445514418,-0.14340103301107193,0.0014142522448463255,-0.15485213816428023
The government was stirred into action by the Pleadings of Lady Franklin.,The Pleadings of Lady Franklin stirred into action the government.,0.0023043898257432763,-0.0314667636834327,-0.0007453628027958169,-0.02745423956268104
The final relics of the Franklin expedition were discovered by Mcclintock and a party of volunteers.,Mcclintock and a party of volunteers discovered the final relics of the Franklin expedition.,0.005686312865284736,-0.04567028846834158,0.0007835839833663805,-0.014313708234547716
"Much valuable scientific information has been obtained by Mr. Glaisher, and by those who, like him, have made perilous journeys into Cloudland.","Those who, like he, have made perilous journeys into Cloudland has obtained Mr. Glaisher, and much valuable scientific information.",-0.005046819626921449,0.054340056179884404,-0.007854195083451294,0.035700260428170365
Once when he was leading a party at night he was fired at by his own Sentries.,Once when he was leading a party at night his own Sentries fired at him.,-0.0030646344034273776,-0.09932398187869525,-0.009163946900666227,-0.08181281166668691
A gold medal was presented to him by the Emperor.,The Emperor presented to him a gold medal.,0.0002885314656129211,0.005481601997446291,-0.0031129619912922094,-0.011012727051270804
"After a series of the most thrilling incidents the world has known, Lucknow was finally relieved by Sir Colin Campbell.","After a series of the most thrilling incidents the world has known, Sir Colin Campbell finally relieved Lucknow.",-0.005906442999025513,-0.03664962590717545,-0.00947442767353135,-0.01117990413444215
"The books in which he gave an account of his experiences were eagerly read by the public, and produced a profound effect.","The public eagerly read the books in which he gave an account of his experiences, and produced a profound effect.",-0.008265153153976757,0.07074657748654173,-0.009689257760785105,0.06414707901190692
Two persons who tried to help him were bitten by the lion.,The lion bit two persons who tried to help him.,-0.005182167380759466,0.019407005256482895,-0.009246698012889496,-0.013600905462952232
"In November, 1876, he was knocked down in the streets of Carlisle by a runaway horse, and carried into the hospital to die.","In November, 1876, a runaway horse knocked down in the streets of Carlisle him, and carried into the hospital to die.",0.006012925180162958,-0.11811925269184637,0.0032933323013670975,-0.08049412636610762
"Once, whilst Moffat was away on a visit to a neighbouring tribe, his wife was aroused in the night by the report that a hostile tribe had invaded their territory and was close upon them.","Once, whilst Moffat was away on a visit to a neighbouring tribe, the report that a hostile tribe had invaded their territory and was close upon they aroused in the night his wife.",-0.00043350962669599794,-0.10517641407517511,-0.0015312080148847716,-0.09224313527283294
Thither the sick and wounded soldiers were being brought by hundreds.,Hundreds the sick and wounded soldiers Werebringing thither.,0.002312640947844954,-0.09954209233166494,-5.231739556890605e-05,-0.0747020563068211
"Her life was brightened by her belief, and she ever kept in view what she believed to be her mission in life.","Her belief brightened her life, and she ever kept in view she believed what to be her mission in life.",-0.0032112258744345073,-0.041114595757840114,-0.006509083620365623,-0.026318764767307913
"The door was guarded by a detachment of thieves, who watched to see that none but those of their class went in.","A detachment of thieves, who watched to see that none but those of their class went in guarded the door.",0.0032822547308251565,-0.18113342551010747,-0.005208071822410755,-0.02071151173240085
A young woman whilst working in a mill at Stockport was caught by the machinery and badly injured.,The machinery and badly injured caught a young woman whilst working in a mill at Stockport.,0.002795799076122468,-0.021861249205668665,-0.00038226991210661286,0.01316658123784989
"I am permitted, by the kindness of the Rev . H.C.G . Moule, from whose delightful biography the foregoing sketch has been compiled, to reproduce a page from this address.","The kindness of the Rev . H.C.G . Moule, from whose delightful biography the foregoing sketch has been compiled permit, me, to reproduce a page from this address.",-0.005583205085789606,0.07946496992414234,-0.013006823599195375,0.20791178298595847
"Several soldiers were blown to pieces by the bursting of the Shell, but Wellington seemed quite unmoved either by the terrible sight or his own danger.","The bursting of the Shell blew to pieces several soldiers, but Wellington seemed quite unmoved either by the terrible sight or his own danger.",0.006645436984660639,-0.16661611403562757,0.003620560649454707,-0.13641997247646354
"As they were passing through their agony, they were laughed at by the people, who asked them if Jesus Christ could do anything to help them.","As they were passing through their agony, the people, who asked them if Jesus Christ could do anything to help them laughed at them.",-0.0014598438601008759,-0.15426074428164493,-0.0036708244529408914,-0.14329696206475756
How many accidents to children are caused by the Lamentable absence of open spaces and Playgrounds!,The Lamentable absence of open spaces and Playgrounds causes how many accidents to children!,-0.005100286510832551,0.026053293622023604,-0.00716558596115155,0.021162234776583144
"Below, within the store, that view is entirely obliterated by a brace of shelves built across the corresponding window and brilliantly stacked with ribbons of a score of colors and as many widths.","Below, within the store, a brace of shelves built across the corresponding window and brilliantly stacked with ribbons of a score of colors and as many widths entirely Obliterates that view.",-0.0015489102528762635,0.1110949190283588,-0.009016636169774207,0.24296073379950706
"Diseased lungs are exasperated by a certain diet, and pacified by one of an opposite kind.","A certain diet Exasperates diseased lungs, and pacified by one of an opposite kind.",-0.007581828382314667,0.12641994597210807,-0.01057385226573846,0.2469831215987845
"It is usually possessed by those who live in the country, and according to nature, as it is called, and who take much and varied exercise.","Those who live in the country usually possesses it, and according to nature, as it is called, and who take much and varied exercise.",-0.005242399983399209,0.2658364341910593,-0.009329057851541634,0.2353677117369307
"A treatise on the great geological question, whether the continents now inhabited, have or have not been repeatedly submerged in the sea, has lately been read to the Académie des sciences, by M. constant Prevost.","M. constant Prevost lately has read to the Académie des sciences, a treatise on the great geological question, whether the continents now inhabited, have or have not been repeatedly submerged in the sea,.",-0.00216102764039264,0.14050904860648114,-0.004887307939516049,0.1815068797038546
"The stillness had been broken by a slight sound, as of something falling inside the attic, and this was followed a moment later by a shrill, Unearthly scream.","A slight sound had broken the stillness, as of something falling inside the attic, and this was followed a moment later by a shrill, Unearthly scream.",-0.0029977053308393453,0.08401957564377344,-0.004502638554513981,0.09609666638232134
"The loss of their right Half-Back was distinctly felt by the Birchites during the commencement of the second half, and Diggory was called upon three times in quick succession to save his charge.","The Birchites distinctly felt the loss of their right half - back during the commencement of the second half, and Diggory was called upon three times in quick succession to save his charge.",0.0015128704784611994,-0.08497975076950579,0.00014563475691917432,-0.07517566924933655
"Jack Vance was seized by a band of applauding comrades, who, with his head about a couple of feet lower than his heels, carried him in triumph across the playground, and staggered half-way up the steep garden path, when Acton happening to tread on a loose pebble brought the whole procession to grief, and caused the noble band of conquering heroes to be seen all Grovelling in a mixed heap upon the gravel.","A band of applauding comrades, who, with his head about a couple of feet lower than his heels seized Jack Vance, carried him in triumph across the playground, and staggered half - way up the steep garden path, when Acton happening to tread on a loose pebble brought the whole procession to grief, and caused the noble band of conquering heroes to be seen all Grovelling in a mixed heap upon the gravel.",-0.006256245920016882,0.00984230369556947,-0.013095082636646086,0.12342695060906775
"He had been captured by a party of Philistines, who, under the leadership of Hogson, had not only robbed him of his pie, but had held him prisoner while they devoured it before his very eyes!","A party of Philistines, who, under the leadership of Hogson, had not only robbed him of his pie had captured him, but had held him prisoner while they devoured it before his very eyes!",0.002075765803897174,-0.14826759282617546,-0.00682846698184489,0.056795829608021625
"The remainder were occupied by a couple of other New-Comers, and three oldsters, Carton, Hart, and Bayley.","A couple of other new - Comers occupied the remainder, and three oldsters, Carton, Hart, and Bayley.",-0.0034071032008775723,-0.028225381024445273,-0.007983821621879548,0.02216795552306652
"Bibbs, the third form genius, was regarded by every one as a huge joke, and the very mention of his name caused a fresh burst of merriment.","Every one as a huge joke regarded Bibbs, the third form genius,, and the very mention of his name caused a fresh burst of merriment.",-0.004884584494291399,-0.03485332163122126,-0.00799390996343394,-0.052472101411041826
"The Hermitage was surrounded on all sides by a thick mass of shrubs and trees, through which a moment later the triple alliance were cautiously threading their way.","A thick mass of shrubs and trees, through which a moment later the triple alliance were cautiously threading their way surrounded on all sides the Hermitage.",0.0006358863161763529,-0.05245519112859523,-0.005715728718892866,0.08534102163141524
"His presence within the grounds of Ronleigh college was not approved of by the authorities, and his trade with the small boys, who were his particular patrons, was carried on through a gap in the hedge.","The authorities not approved of his presence within the grounds of Ronleigh college, and his trade with the small boys, who were his particular patrons, was carried on through a gap in the hedge.",0.007271051773407246,-0.18052045796381888,0.007514482277895121,-0.1981045851928983
"On Friday evening the two doors, which were exactly opposite to each other, being left open, the process of undressing was enlivened by a continual fire of abuse and insulting remarks, which might have led to a regular scrimmage between the two parties if the presence of the Prefect, patrolling the passage, had not prevented either side from advancing beyond the threshold of their own doorway.","On Friday evening the two doors, which were exactly opposite to each other, being left open, a continual fire of abuse and insulting remarks, which might have led to a regular scrimmage between the two parties if the presence of the Prefect, patrolling the passage enlivened the process of undressing, had not prevented either side from advancing beyond the threshold of their own doorway.",0.001962961760399245,-0.1214430083361955,0.0014555851833928917,-0.13686577218681029
"In addition to the loss of Thurston, who, to do him justice, was a very good forward, the school team was weakened still further by an unfortunate accident which befell Rowlands, who twisted his ankle, and was forced to leave the ground at the very commencement of the game.","In addition to the loss of Thurston, who, to do him justice, was a very good forward, an unfortunate accident which befell Rowlands, who twisted his ankle, weakened still further the school team and was forced to leave the ground at the very commencement of the game.",-0.001406217718267103,-0.11126619905209215,-0.0030476849965471297,-0.09281518544320834
The passage of arms between Mr. Grice and the two Prefects was eagerly discussed by boys of all ages.,Boys of all ages eagerly discussed the passage of arms between Mr. Grice and the two Prefects.,-0.0025183346447529044,-0.008595862275538945,-0.0089963405838305,0.02006651276490869
"This factor can only be fostered by the ability to maintain not one, but a group of high class teams.","The ability to maintain not one only can foster this factor, but a group of high class teams.",-0.004394815351737884,0.06254894509737488,-0.010436153501554109,0.14433738921119554
"For that reason players and owners must be guided by a sense of lofty ideals and not be led astray by foolish outbursts over trivial differences of opinion, easily to be adjusted by the exercise of a little common sense.","For that reason a sense of lofty ideals must guide players and owners and not be led astray by foolish outbursts over trivial differences of opinion, easily to be adjusted by the exercise of a little common sense.",-0.0011981388853107475,-0.06779071923540442,-0.005293804120010759,-0.021265970246433737
"The books will be distributed by a well-known book firm, Bjork & Boyeson, Stockholm, and will soon be available in all the bookstores in Sweden.","A well - known book firm, Bjork & Boyeson, Stockholm will distribute the books, and will soon be available in all the bookstores in Sweden.",-0.0022234380788731445,0.10887171018222322,-0.004102774174207456,0.10240006318376316
"Mr. brush is survived by his widow, Mrs. Elsie Lombard brush, and two daughters, Miss Natalie brush and Mrs. Harry N. Hempstead.","His widow survives Mr. brush, Mrs. Elsie Lombard brush, and two daughters, Miss Natalie brush and Mrs. Harry N. Hempstead.",-0.003725881582098047,-0.0574696704988525,-0.005724041602616373,-0.06925462643373347
"The motives of Mr. brush were thoroughly misconstrued by some, and, if grasped by others, they were disregarded, because they Conflicted with their immediate temporary prosperity.","Some thoroughly misconstrued the motives of Mr. brush, and, if grasped by others, them were disregarded, because they Conflicted with their immediate temporary prosperity.",-0.004996794622870121,-0.02192970268061165,-0.0076536883006331664,0.012475848674999707
"Prominent National League players were taken by the American League clubs, and this brought retaliation.","The American League clubs took prominent National League players, and this brought retaliation.",-0.0005625338713419043,-0.003592184194483275,-0.0027869732309881022,-0.012527563316664644
A man less determined would have been overcome by such a blow.,Such a blow would have overcome a man less determined.,-0.004241613084036422,-0.11969598079478404,-0.004707664304305858,-0.1937319126645064
"Gardner was put out by a combination play on the part of Mathewson, Doyle and Merkle, scoring Yerkes, and Stahl came through with a hard line hit for a base, which scored Speaker and Lewis.","A combination play on the part of Mathewson, Doyle and Merkle, scoring Yerkes put out Gardner, and Stahl came through with a hard line hit for a base, which scored Speaker and Lewis.",-0.002015473809330158,-0.033341515216967946,-0.007718120063932661,0.04689640617500783
"By far the most notable play of the game on the field was made by Devore in the ninth inning, when he ran for more than thirty feet and caught an almost impossible fly ball which had been batted by Cady.","By far Devore made the most notable play of the game on the field in the ninth inning, when he ran for more than thirty feet and caught an almost impossible fly ball which had been batted by Cady.",-0.0011291399979612838,-0.013864134171091717,-0.0032969411550471148,-0.05188219121923388
Wood was retired by Murray.,Murray retired wood.,0.002689490823997541,-0.08353959795888505,-0.006088904406343611,0.017795010353255904
"With one out in the fourth, Gardner was hit by a pitched ball and Stahl singled to left field.","With one out in the fourth, a pitched ball and Stahl singled to left field hit Gardner.",-0.0015433643197512786,-0.042774215438070966,-0.006166493590384084,0.012651948227909852
No runs were scored by either team in the eighth or the ninth innings.,Either team scored no runs in the eighth or the ninth innings.,0.007290295244051907,-0.22018802639585278,8.265206390095105e-05,-0.12745139005393236
So much speed had been put into it by the stalwart Indian catcher that had the ball got into the outfield it would have gone to the fence.,The stalwart Indian catcher that had the ball got into the outfield it would have gone to the fence had put into it so much speed.,-0.0005736471113444532,-0.07439829349502775,-0.0026380367103342123,-0.08262481689278015
"The athletics were beaten out by two teams which were in the second division in 1911, one of them as low as Seventh place.","Two teams which were in the second division in 1911, one of they as low as Seventh place beat out the Athletics.",0.007082779298635749,-0.1053134229118314,0.003855740554544222,-0.06787669876573295
"These men were helped somewhat by the showing of their team, but the case of Gandil would have been notable in any company.","The showing of their team helped somewhat these men, but the case of Gandil would have been notable in any company.",0.00329083572670919,-0.09449308436140058,0.002283111375094376,-0.11964278610583598
As they entered they were received by expectant looks.,As they entered expectant looks received them.,-0.0006798548846127911,-0.07431094716726001,-0.00652873042845532,-0.0060469651265775345
As she went by she was naturally attracted by the lighted windows and could hear the band quite plainly.,As she went by the lighted windows naturally attracted her and could hear the band quite plainly.,-0.0025644154600993853,-0.003986319240368522,-0.003853506753941774,0.002280136694154524
